subreddit,post_id,titulo,upvotes,comentarios,compartilhamentos,formato,tags,linguagem,url
learnprogramming,1glesxs,I need to solve this,1,3,0,texto,,Outros,https://www.reddit.com/r/learnprogramming/comments/1glesxs/i_need_to_solve_this/
learnprogramming,1glep3r,"What should I focus on next in my first semester of Production Engineering: DSA, Web Development, or something else?",2,1,0,texto,,Outros,https://www.reddit.com/r/learnprogramming/comments/1glep3r/what_should_i_focus_on_next_in_my_first_semester/
learnprogramming,1glemhn,Scrimba pro?,2,0,0,texto,,Outros,https://www.reddit.com/r/learnprogramming/comments/1glemhn/scrimba_pro/
learnprogramming,1glegiw,Where to start for specific Project,2,2,0,texto,,Outros,https://www.reddit.com/r/learnprogramming/comments/1glegiw/where_to_start_for_specific_project/
learnprogramming,1gle9f8,What and where should I start?,2,1,0,texto,,Outros,https://www.reddit.com/r/learnprogramming/comments/1gle9f8/what_and_where_should_i_start/
learnprogramming,1gldi7c,can you program while drunk???,0,9,0,texto,,Outros,https://www.reddit.com/r/learnprogramming/comments/1gldi7c/can_you_program_while_drunk/
learnprogramming,1gldc3d,C for strong base?,7,11,0,texto,,C,https://www.reddit.com/r/learnprogramming/comments/1gldc3d/c_for_strong_base/
learnprogramming,1glchnn,Using window objects to define Javascript variables for Chrome extension,1,1,0,texto,,JavaScript,https://www.reddit.com/r/learnprogramming/comments/1glchnn/using_window_objects_to_define_javascript/
learnprogramming,1glaxx9,Anyone here dyslexic? Thinking about learning web dev code to help with my marketing role. Wondering if any other dyslexics have any advice? ,2,7,0,texto,,Outros,https://www.reddit.com/r/learnprogramming/comments/1glaxx9/anyone_here_dyslexic_thinking_about_learning_web/
learnprogramming,1glaq3a,Is Wikidata a good API for getting location information?,1,0,0,texto,,Outros,https://www.reddit.com/r/learnprogramming/comments/1glaq3a/is_wikidata_a_good_api_for_getting_location/
learnprogramming,1glamlw,How do I learn flutter?,2,7,0,texto,,Flutter,https://www.reddit.com/r/learnprogramming/comments/1glamlw/how_do_i_learn_flutter/
learnprogramming,1glabsv,Tips for getting through learning syntax?,5,5,0,texto,Topic,Outros,https://www.reddit.com/r/learnprogramming/comments/1glabsv/tips_for_getting_through_learning_syntax/
learnprogramming,1gla0ne,"Feeling like a failure, looking for few advice ",2,4,0,texto,,Outros,https://www.reddit.com/r/learnprogramming/comments/1gla0ne/feeling_like_a_failure_looking_for_few_advice/
learnprogramming,1gl8sh7,In alot of despair because there's almost no resources on VisualBasic,0,17,0,texto,,Outros,https://www.reddit.com/r/learnprogramming/comments/1gl8sh7/in_alot_of_despair_because_theres_almost_no/
learnprogramming,1gl8lmv,How many time did you spend learning programming?,7,33,0,texto,,Outros,https://www.reddit.com/r/learnprogramming/comments/1gl8lmv/how_many_time_did_you_spend_learning_programming/
learnprogramming,1gl8ay5,Stack Recommendations,0,3,0,texto,,Outros,https://www.reddit.com/r/learnprogramming/comments/1gl8ay5/stack_recommendations/
learnprogramming,1gl77d2,Should I learn Java or C++?,17,26,0,texto,,Java,https://www.reddit.com/r/learnprogramming/comments/1gl77d2/should_i_learn_java_or_c/
learnprogramming,1gl6kmj,How real is the AI takeover?,0,18,0,texto,,Outros,https://www.reddit.com/r/learnprogramming/comments/1gl6kmj/how_real_is_the_ai_takeover/
learnprogramming,1gl5p3g,Java and Collections Library,3,2,0,texto,,Java,https://www.reddit.com/r/learnprogramming/comments/1gl5p3g/java_and_collections_library/
learnprogramming,1gl5oh1,What's a good web based programming service to train neural networks?,1,0,0,texto,,Outros,https://www.reddit.com/r/learnprogramming/comments/1gl5oh1/whats_a_good_web_based_programming_service_to/
learnprogramming,1gl5jcu,Which programming language should i use?,3,5,0,texto,,Outros,https://www.reddit.com/r/learnprogramming/comments/1gl5jcu/which_programming_language_should_i_use/
learnprogramming,1gl59vk,I studied Programming in deep and I want to learn electronics (Analog and Digital),0,4,0,texto,,Outros,https://www.reddit.com/r/learnprogramming/comments/1gl59vk/i_studied_programming_in_deep_and_i_want_to_learn/
learnprogramming,1gl598d,"Which language to learn (Finance, Statistics, Optimization)?",3,3,0,texto,,Outros,https://www.reddit.com/r/learnprogramming/comments/1gl598d/which_language_to_learn_finance_statistics/
learnprogramming,1gl509u,Which programming language for a work scheduling app,1,22,0,texto,,Outros,https://www.reddit.com/r/learnprogramming/comments/1gl509u/which_programming_language_for_a_work_scheduling/
learnprogramming,1gl4k85,IDE,1,8,0,texto,,Outros,https://www.reddit.com/r/learnprogramming/comments/1gl4k85/ide/
learnprogramming,1gl3xyo,why cant Chat GPT understand RUST code?,0,12,0,texto,,Rust,https://www.reddit.com/r/learnprogramming/comments/1gl3xyo/why_cant_chat_gpt_understand_rust_code/
learnprogramming,1gl3y07,Mutability issue with user entered data.,1,5,0,texto,Topic,Outros,https://www.reddit.com/r/learnprogramming/comments/1gl3y07/mutability_issue_with_user_entered_data/
learnprogramming,1gl3ptx,Building my first independent project and my border has a bunch of extra space on the right side? Not sure how to solve it.,1,5,0,texto,,Outros,https://www.reddit.com/r/learnprogramming/comments/1gl3ptx/building_my_first_independent_project_and_my/
learnprogramming,1gl34na,Java Project Ideas for Beginner to intermediate level,1,3,0,texto,,Java,https://www.reddit.com/r/learnprogramming/comments/1gl34na/java_project_ideas_for_beginner_to_intermediate/
learnprogramming,1gl2ene,Should trainees use copilot when learning?,0,7,0,texto,,Outros,https://www.reddit.com/r/learnprogramming/comments/1gl2ene/should_trainees_use_copilot_when_learning/
learnprogramming,1gl2435,"""Is it a good approach to learn DSA in Python and solve problems in C++?""",7,4,0,texto,,Python,https://www.reddit.com/r/learnprogramming/comments/1gl2435/is_it_a_good_approach_to_learn_dsa_in_python_and/
learnprogramming,1gl1lht,Communication frustrations,1,0,0,texto,,Outros,https://www.reddit.com/r/learnprogramming/comments/1gl1lht/communication_frustrations/
learnprogramming,1gl18if,Seeking Help,2,3,0,texto,,Outros,https://www.reddit.com/r/learnprogramming/comments/1gl18if/seeking_help/
learnprogramming,1gl0irp,React js ,0,3,0,texto,Resource,React,https://www.reddit.com/r/learnprogramming/comments/1gl0irp/react_js/
learnprogramming,1gkzsu3,Struggling with writing algorithms in code ,11,13,0,texto,,Outros,https://www.reddit.com/r/learnprogramming/comments/1gkzsu3/struggling_with_writing_algorithms_in_code/
learnprogramming,1gkzqhz,Using tutorials is beneficial if you make notes,16,6,0,texto,Topic,Outros,https://www.reddit.com/r/learnprogramming/comments/1gkzqhz/using_tutorials_is_beneficial_if_you_make_notes/
learnprogramming,1gkzbas,Professional crossroads,0,4,0,texto,,Outros,https://www.reddit.com/r/learnprogramming/comments/1gkzbas/professional_crossroads/
learnprogramming,1gkz5j9,Bootcamp Entry Challenge - Feeling Very Unprepared,1,2,0,texto,,Outros,https://www.reddit.com/r/learnprogramming/comments/1gkz5j9/bootcamp_entry_challenge_feeling_very_unprepared/
learnprogramming,1gkyfwb,Snake Game: Detecting when Snake collides with it's own body,7,4,0,texto,,Outros,https://www.reddit.com/r/learnprogramming/comments/1gkyfwb/snake_game_detecting_when_snake_collides_with_its/
learnprogramming,1gkwhhz,Graphs with live data without database,2,4,0,texto,,Outros,https://www.reddit.com/r/learnprogramming/comments/1gkwhhz/graphs_with_live_data_without_database/
learnprogramming,1gkvvmi,"Beginner's guide, what to prepare?",3,8,0,texto,,Outros,https://www.reddit.com/r/learnprogramming/comments/1gkvvmi/beginners_guide_what_to_prepare/
learnprogramming,1gkufep,Keeping sharp when you don't have a computer?,34,23,0,texto,,Outros,https://www.reddit.com/r/learnprogramming/comments/1gkufep/keeping_sharp_when_you_dont_have_a_computer/
learnprogramming,1gkttvf,Commits frequency,3,7,0,texto,,Outros,https://www.reddit.com/r/learnprogramming/comments/1gkttvf/commits_frequency/
learnprogramming,1gktswa,I don't understand coding after hours of trying ,0,43,0,texto,,Outros,https://www.reddit.com/r/learnprogramming/comments/1gktswa/i_dont_understand_coding_after_hours_of_trying/
learnprogramming,1gktohk,How should I continue to grow my skillset as an aspiring .NET developer?,1,2,0,texto,,Outros,https://www.reddit.com/r/learnprogramming/comments/1gktohk/how_should_i_continue_to_grow_my_skillset_as_an/
learnprogramming,1gkt6xf,Advice on Becoming a Strong Backend Developer?,8,13,0,texto,,Outros,https://www.reddit.com/r/learnprogramming/comments/1gkt6xf/advice_on_becoming_a_strong_backend_developer/
learnprogramming,1gkt0xx,Simple Noob Question,3,1,0,texto,,Outros,https://www.reddit.com/r/learnprogramming/comments/1gkt0xx/simple_noob_question/
learnprogramming,1gks7iy,"Creating a Dynamic Overlay for a Browser Game - Desktop App, Web App, or Extension?",2,1,0,texto,,Outros,https://www.reddit.com/r/learnprogramming/comments/1gks7iy/creating_a_dynamic_overlay_for_a_browser_game/
learnprogramming,1gkqgtt,Learning programming by yourself is lonely,289,78,0,texto,,Outros,https://www.reddit.com/r/learnprogramming/comments/1gkqgtt/learning_programming_by_yourself_is_lonely/
learnprogramming,1gkoavc,Where do I go from here?,0,2,0,texto,,Go,https://www.reddit.com/r/learnprogramming/comments/1gkoavc/where_do_i_go_from_here/
learnprogramming,1gkn74s,Discord to Roblox Bot Help,2,0,0,texto,Debugging,Outros,https://www.reddit.com/r/learnprogramming/comments/1gkn74s/discord_to_roblox_bot_help/
learnprogramming,1gkmkzi,Balancing perseverance with practicality,1,0,0,texto,,Outros,https://www.reddit.com/r/learnprogramming/comments/1gkmkzi/balancing_perseverance_with_practicality/
learnprogramming,1gklp3z,What are libraries in python (they are made by others?),0,7,0,texto,,Python,https://www.reddit.com/r/learnprogramming/comments/1gklp3z/what_are_libraries_in_python_they_are_made_by/
learnprogramming,1gkl7t1,"Used VB back in the day, ready to modernize. Suggestions?",3,6,0,texto,,Outros,https://www.reddit.com/r/learnprogramming/comments/1gkl7t1/used_vb_back_in_the_day_ready_to_modernize/
learnprogramming,1gkk9kr,"Hi, I'm working in Backend roadmap",0,0,0,texto,,Outros,https://www.reddit.com/r/learnprogramming/comments/1gkk9kr/hi_im_working_in_backend_roadmap/
learnprogramming,1gkk8c5,Whatâ€™s the best IP geolocation API in the market now? ,1,0,0,texto,Topic,Outros,https://www.reddit.com/r/learnprogramming/comments/1gkk8c5/whats_the_best_ip_geolocation_api_in_the_market/
learnprogramming,1gkjct0,Even the worst student of my class can write CRUDs. How to stand out?,76,55,0,texto,,Outros,https://www.reddit.com/r/learnprogramming/comments/1gkjct0/even_the_worst_student_of_my_class_can_write/
learnprogramming,1gkj2er,Understanding the Distinction Between Software Engineering and Software Development,6,5,0,texto,,Outros,https://www.reddit.com/r/learnprogramming/comments/1gkj2er/understanding_the_distinction_between_software/
learnprogramming,1gkhc6s,Anyone else feel like they should/shouldn't be learning X and Y as a way to more efficiently use time learning?,5,17,0,texto,,Outros,https://www.reddit.com/r/learnprogramming/comments/1gkhc6s/anyone_else_feel_like_they_shouldshouldnt_be/
learnprogramming,1gkgtju,Implementing algorithms ,0,2,0,texto,,Outros,https://www.reddit.com/r/learnprogramming/comments/1gkgtju/implementing_algorithms/
learnprogramming,1gkfr0t,UK Bootcamps vs CS degree,2,3,0,texto,,Outros,https://www.reddit.com/r/learnprogramming/comments/1gkfr0t/uk_bootcamps_vs_cs_degree/
learnprogramming,1gkfnje,Is it possible to code on a phone without a computer?,0,21,0,texto,,Outros,https://www.reddit.com/r/learnprogramming/comments/1gkfnje/is_it_possible_to_code_on_a_phone_without_a/
learnprogramming,1gkf1p1,What to do after build completed,0,2,0,texto,Debugging,Outros,https://www.reddit.com/r/learnprogramming/comments/1gkf1p1/what_to_do_after_build_completed/
learnprogramming,1gkequn,Why is programming enphasing the use of 'special' words for everything?,0,12,0,texto,,Outros,https://www.reddit.com/r/learnprogramming/comments/1gkequn/why_is_programming_enphasing_the_use_of_special/
learnprogramming,1gkegt4,What is the correct way to go about refactoring code?,10,13,0,texto,Topic: Refactoring,Go,https://www.reddit.com/r/learnprogramming/comments/1gkegt4/what_is_the_correct_way_to_go_about_refactoring/
learnprogramming,1gkdy73,Keys stuck in a loop,2,0,0,texto,,Outros,https://www.reddit.com/r/learnprogramming/comments/1gkdy73/keys_stuck_in_a_loop/
learnprogramming,1gkd03q,Is order of includes consistent? C++,3,5,0,texto,,C,https://www.reddit.com/r/learnprogramming/comments/1gkd03q/is_order_of_includes_consistent_c/
learnprogramming,1gkcxiu,Offline map formats?,3,4,0,texto,Resource,Outros,https://www.reddit.com/r/learnprogramming/comments/1gkcxiu/offline_map_formats/
learnprogramming,1gkcuz1,Hard to understand,9,8,0,texto,,Outros,https://www.reddit.com/r/learnprogramming/comments/1gkcuz1/hard_to_understand/
learnprogramming,1gkbcok,How to stop Lazy as Developer ,0,8,0,texto,,Outros,https://www.reddit.com/r/learnprogramming/comments/1gkbcok/how_to_stop_lazy_as_developer/
learnprogramming,1gkar15,Anybody ever tried or developed an Operating system,120,75,0,texto,Resource,Outros,https://www.reddit.com/r/learnprogramming/comments/1gkar15/anybody_ever_tried_or_developed_an_operating/
learnprogramming,1gkaiod,Unpaid internship is it worth?,2,1,0,texto,,Outros,https://www.reddit.com/r/learnprogramming/comments/1gkaiod/unpaid_internship_is_it_worth/
learnprogramming,1gka5e9,I'm paddling water without a solid plan on how to improve as an aspiring FE Dev,2,6,0,texto,,Outros,https://www.reddit.com/r/learnprogramming/comments/1gka5e9/im_paddling_water_without_a_solid_plan_on_how_to/
learnprogramming,1gk9ug8,Resources for learning discrete math+ dsa/self learning CS curriculum while in school?,3,2,0,texto,,Outros,https://www.reddit.com/r/learnprogramming/comments/1gk9ug8/resources_for_learning_discrete_math_dsaself/
learnprogramming,1gk9889,"What is the best AI model for reviewing computer science subjects? (Preferably free)""",0,6,0,texto,,Outros,https://www.reddit.com/r/learnprogramming/comments/1gk9889/what_is_the_best_ai_model_for_reviewing_computer/
learnprogramming,1gk8i91,Unable to replace an object as a value to a field in mongo db,2,3,0,texto,,Outros,https://www.reddit.com/r/learnprogramming/comments/1gk8i91/unable_to_replace_an_object_as_a_value_to_a_field/
learnprogramming,1gk8h8k,Is zed a good text editor?,6,16,0,texto,,Outros,https://www.reddit.com/r/learnprogramming/comments/1gk8h8k/is_zed_a_good_text_editor/
learnprogramming,1gk8gmd,Is this enough to build a wep app (SAAS)?,0,2,0,texto,,Outros,https://www.reddit.com/r/learnprogramming/comments/1gk8gmd/is_this_enough_to_build_a_wep_app_saas/
learnprogramming,1gk73rx,Pretty confused on how to proceed further,0,7,0,texto,Resource,Outros,https://www.reddit.com/r/learnprogramming/comments/1gk73rx/pretty_confused_on_how_to_proceed_further/
learnprogramming,1gk6wmi,New to programming and need help understanding on the requirement,2,5,0,texto,,Outros,https://www.reddit.com/r/learnprogramming/comments/1gk6wmi/new_to_programming_and_need_help_understanding_on/
learnprogramming,1gk6q8x,I'm going crazy trying to setup Visual Studio / VS code,0,21,0,texto,Resource,Outros,https://www.reddit.com/r/learnprogramming/comments/1gk6q8x/im_going_crazy_trying_to_setup_visual_studio_vs/
learnprogramming,1gk620r,Is this true?,109,52,0,texto,,Outros,https://www.reddit.com/r/learnprogramming/comments/1gk620r/is_this_true/
learnprogramming,1gk5zqr,What is the language to learn at first? ,2,16,0,texto,,Outros,https://www.reddit.com/r/learnprogramming/comments/1gk5zqr/what_is_the_language_to_learn_at_first/
learnprogramming,1gk5v3l,Coding project ideas,2,3,0,texto,,Outros,https://www.reddit.com/r/learnprogramming/comments/1gk5v3l/coding_project_ideas/
learnprogramming,1gk5r6l,Well structured python project that calls REST APIs,3,0,0,texto,,Python,https://www.reddit.com/r/learnprogramming/comments/1gk5r6l/well_structured_python_project_that_calls_rest/
learnprogramming,1gk5qyk,Is there a programming language (used in modern times for software dev.) not based in C?,24,86,0,texto,Topic,C,https://www.reddit.com/r/learnprogramming/comments/1gk5qyk/is_there_a_programming_language_used_in_modern/
learnprogramming,1gk5lsj,Outline vs filled svg,4,10,0,texto,,Outros,https://www.reddit.com/r/learnprogramming/comments/1gk5lsj/outline_vs_filled_svg/
learnprogramming,1gk5d2s,Is it wrong or harmful to use AI to code?,0,59,0,texto,,Outros,https://www.reddit.com/r/learnprogramming/comments/1gk5d2s/is_it_wrong_or_harmful_to_use_ai_to_code/
learnprogramming,1gk5bit,QA Engineer to backend dev. What to prepare?,2,0,0,texto,,Outros,https://www.reddit.com/r/learnprogramming/comments/1gk5bit/qa_engineer_to_backend_dev_what_to_prepare/
learnprogramming,1gk591h,Location of header with communication details in C++(lib or service),3,0,0,texto,,C,https://www.reddit.com/r/learnprogramming/comments/1gk591h/location_of_header_with_communication_details_in/
learnprogramming,1gk50hr,I have a question about Strava's API,3,0,0,texto,,Outros,https://www.reddit.com/r/learnprogramming/comments/1gk50hr/i_have_a_question_about_stravas_api/
learnprogramming,1gk4qxy,Shortest Path Tree doubt,3,2,0,texto,,Outros,https://www.reddit.com/r/learnprogramming/comments/1gk4qxy/shortest_path_tree_doubt/
learnprogramming,1gk4j22,Best way to play a text based games?,7,12,0,texto,,Outros,https://www.reddit.com/r/learnprogramming/comments/1gk4j22/best_way_to_play_a_text_based_games/
learnprogramming,1gk4hcu,Lightweight Food recipes RestAPI with admin dashboard and docker ðŸ‘Œ ,0,0,0,texto,Topic,Outros,https://www.reddit.com/r/learnprogramming/comments/1gk4hcu/lightweight_food_recipes_restapi_with_admin/
learnprogramming,1gk3g1l,Please evaluate my code,0,0,0,texto,,Outros,https://www.reddit.com/r/learnprogramming/comments/1gk3g1l/please_evaluate_my_code/
learnprogramming,1gk3fg5,how do i download this audio,0,0,0,texto,,Outros,https://www.reddit.com/r/learnprogramming/comments/1gk3fg5/how_do_i_download_this_audio/
learnprogramming,1gk3doi,"No programming language feels ""proper"" for what I want to do",0,14,0,texto,,Outros,https://www.reddit.com/r/learnprogramming/comments/1gk3doi/no_programming_language_feels_proper_for_what_i/
learnprogramming,1gk34ib,Can't connect to my local asp net web application,1,0,0,texto,Debugging,Outros,https://www.reddit.com/r/learnprogramming/comments/1gk34ib/cant_connect_to_my_local_asp_net_web_application/
learnprogramming,1gk2zxy,How much java and other concepts should I know before learning Spring boot ,3,3,0,texto,,Java,https://www.reddit.com/r/learnprogramming/comments/1gk2zxy/how_much_java_and_other_concepts_should_i_know/
learnprogramming,1gk2zg9,ASCII table for all the beginners,2,3,0,texto,,Outros,https://www.reddit.com/r/learnprogramming/comments/1gk2zg9/ascii_table_for_all_the_beginners/
learnprogramming,1gk2zfg,Books to purchase ,2,7,0,texto,,Outros,https://www.reddit.com/r/learnprogramming/comments/1gk2zfg/books_to_purchase/
learnprogramming,1gk2ltp,find and replace in notepad++,1,3,0,texto,,Outros,https://www.reddit.com/r/learnprogramming/comments/1gk2ltp/find_and_replace_in_notepad/
learnprogramming,1gk2eq9,Iâ€™m creating a job portal website. Still can't decide if I should go with Next.js or Angular. Any suggestions?,0,3,0,texto,,Go,https://www.reddit.com/r/learnprogramming/comments/1gk2eq9/im_creating_a_job_portal_website_still_cant/
learnprogramming,1gk2cry,Help on designing database,3,2,0,texto,,Outros,https://www.reddit.com/r/learnprogramming/comments/1gk2cry/help_on_designing_database/
learnprogramming,1gk2cg5,Ai roadmap for recent grad?,1,4,0,texto,,Outros,https://www.reddit.com/r/learnprogramming/comments/1gk2cg5/ai_roadmap_for_recent_grad/
learnprogramming,1gk25fh,Practice ,3,15,0,texto,,Outros,https://www.reddit.com/r/learnprogramming/comments/1gk25fh/practice/
learnprogramming,1gk20i7,Im trying to start a carrier in IT (advice needed),3,4,0,texto,,Outros,https://www.reddit.com/r/learnprogramming/comments/1gk20i7/im_trying_to_start_a_carrier_in_it_advice_needed/
learnprogramming,1gk20gt,Which language? ,0,7,0,texto,,Outros,https://www.reddit.com/r/learnprogramming/comments/1gk20gt/which_language/
learnprogramming,1gk1kbb,How can I improve myself towards having a job?,10,7,0,texto,,Outros,https://www.reddit.com/r/learnprogramming/comments/1gk1kbb/how_can_i_improve_myself_towards_having_a_job/
learnprogramming,1gk1ik4,Help with Python Function for Player Transfer History â€“ Handling Same-Day Transfers!,1,1,0,texto,,Python,https://www.reddit.com/r/learnprogramming/comments/1gk1ik4/help_with_python_function_for_player_transfer/
learnprogramming,1gk1hnv,Why would I ever want to manually add a route to a routing table?,1,4,0,texto,,Outros,https://www.reddit.com/r/learnprogramming/comments/1gk1hnv/why_would_i_ever_want_to_manually_add_a_route_to/
learnprogramming,1gk0smw,Learn C or Python first?,15,39,0,texto,,Python,https://www.reddit.com/r/learnprogramming/comments/1gk0smw/learn_c_or_python_first/
learnprogramming,1gk0h0w,Looking for help to improve my quiz game website with chatGPT API,0,4,0,texto,Debugging,Outros,https://www.reddit.com/r/learnprogramming/comments/1gk0h0w/looking_for_help_to_improve_my_quiz_game_website/
learnprogramming,1gk03mr,Panda Dataframe and running a classifier on it,2,1,0,texto,Tutorial,Outros,https://www.reddit.com/r/learnprogramming/comments/1gk03mr/panda_dataframe_and_running_a_classifier_on_it/
learnprogramming,1gjzqst,Unable to stick to one language,2,11,0,texto,Help,Outros,https://www.reddit.com/r/learnprogramming/comments/1gjzqst/unable_to_stick_to_one_language/
learnprogramming,1gjy3uz,Files and Exceptions ,3,4,0,texto,Debugging,Outros,https://www.reddit.com/r/learnprogramming/comments/1gjy3uz/files_and_exceptions/
learnprogramming,1gjxndv,"I want to create a single quote to declare the winner using a def function, but I can't get it to work. ",5,2,0,texto,,Outros,https://www.reddit.com/r/learnprogramming/comments/1gjxndv/i_want_to_create_a_single_quote_to_declare_the/
learnprogramming,1gjxdgf,"Iâ€™m at a loss, which career path should I take?",23,14,0,texto,,Outros,https://www.reddit.com/r/learnprogramming/comments/1gjxdgf/im_at_a_loss_which_career_path_should_i_take/
learnprogramming,1gjwucq,Need to run JavaFX with Eclipse for school but theres an error,4,5,0,texto,,Outros,https://www.reddit.com/r/learnprogramming/comments/1gjwucq/need_to_run_javafx_with_eclipse_for_school_but/
learnprogramming,1gjwkct,How to identify guitar sound from background noises and other non-guitar sound?,3,6,0,texto,,Outros,https://www.reddit.com/r/learnprogramming/comments/1gjwkct/how_to_identify_guitar_sound_from_background/
learnprogramming,1gjvmdu,"Position element next to group of centered elements without the group moving from the center
",2,2,0,texto,,Outros,https://www.reddit.com/r/learnprogramming/comments/1gjvmdu/position_element_next_to_group_of_centered/
learnprogramming,1gjvgiy,Which boolean operator has the highest precedence among the comparison operators?,3,14,0,texto,,Outros,https://www.reddit.com/r/learnprogramming/comments/1gjvgiy/which_boolean_operator_has_the_highest_precedence/
learnprogramming,1gjvfx3,Binary search tree,2,2,0,texto,Topic,Outros,https://www.reddit.com/r/learnprogramming/comments/1gjvfx3/binary_search_tree/
learnprogramming,1gjv56z,Okay so what actually are templates? Like actually.,4,4,0,texto,,Outros,https://www.reddit.com/r/learnprogramming/comments/1gjv56z/okay_so_what_actually_are_templates_like_actually/
learnprogramming,1gjuero,Bootcamp for career in bioinformatics? ,2,2,0,texto,,Outros,https://www.reddit.com/r/learnprogramming/comments/1gjuero/bootcamp_for_career_in_bioinformatics/
learnprogramming,1gjt8f4,"Places to find DSA practice problems & exams for classes rather than tech interviews?
",1,0,0,texto,,Outros,https://www.reddit.com/r/learnprogramming/comments/1gjt8f4/places_to_find_dsa_practice_problems_exams_for/
learnprogramming,1gjsmup,How to organize tons of digital resources,3,6,0,texto,Topic,Outros,https://www.reddit.com/r/learnprogramming/comments/1gjsmup/how_to_organize_tons_of_digital_resources/
learnprogramming,1gjruem,"Everyone is asking ""Which Tech Stack should I learn""",3,9,0,texto,,Outros,https://www.reddit.com/r/learnprogramming/comments/1gjruem/everyone_is_asking_which_tech_stack_should_i_learn/
learnprogramming,1gjrl55,Alternatives to repl.it for teaching young students?,2,0,0,texto,,Outros,https://www.reddit.com/r/learnprogramming/comments/1gjrl55/alternatives_to_replit_for_teaching_young_students/
learnprogramming,1gjrkza,Curly Bracket Formatting VS Code,2,2,0,texto,,Outros,https://www.reddit.com/r/learnprogramming/comments/1gjrkza/curly_bracket_formatting_vs_code/
learnprogramming,1gjrao7,"I'm running into some issues using a 2d Matrix, I keep getting An object is needed but a I'm sending in an int? anyway I can do this?",2,1,0,texto,,Outros,https://www.reddit.com/r/learnprogramming/comments/1gjrao7/im_running_into_some_issues_using_a_2d_matrix_i/
learnprogramming,1gjr2xo,OAuth2 from Cognito to app -- where do I use the access token?,2,1,0,texto,,Outros,https://www.reddit.com/r/learnprogramming/comments/1gjr2xo/oauth2_from_cognito_to_app_where_do_i_use_the/
learnprogramming,1gjqs1t,quadriplegic software engineering ,10,8,0,texto,,Outros,https://www.reddit.com/r/learnprogramming/comments/1gjqs1t/quadriplegic_software_engineering/
learnprogramming,1gjqh2z,Finished MOOC.fi Java Course â€” Next Steps?,1,0,0,texto,ADVANCE JAVA - HELP,Java,https://www.reddit.com/r/learnprogramming/comments/1gjqh2z/finished_moocfi_java_course_next_steps/
