subreddit,post_id,titulo,upvotes,comentarios,compartilhamentos,formato,tags,linguagem,url
learnprogramming,1ge5j3c,Python: Showing Flask flash-message after using js fetch,3,2,0,texto,,Python,https://www.reddit.com/r/learnprogramming/comments/1ge5j3c/python_showing_flask_flashmessage_after_using_js/
learnprogramming,1ge5ahs,R vs Python for prospective graduate student in Biology,3,2,0,texto,,Python,https://www.reddit.com/r/learnprogramming/comments/1ge5ahs/r_vs_python_for_prospective_graduate_student_in/
learnprogramming,1ge551z,The fear,8,6,0,texto,,Outros,https://www.reddit.com/r/learnprogramming/comments/1ge551z/the_fear/
learnprogramming,1ge53k9,CodeCrafters Free week,3,0,0,texto,,Outros,https://www.reddit.com/r/learnprogramming/comments/1ge53k9/codecrafters_free_week/
learnprogramming,1ge530i,Is pytorch worth learning ,0,1,0,texto,,Outros,https://www.reddit.com/r/learnprogramming/comments/1ge530i/is_pytorch_worth_learning/
learnprogramming,1ge4x19,What resources suppliment MDN?,2,6,0,texto,Resource,Outros,https://www.reddit.com/r/learnprogramming/comments/1ge4x19/what_resources_suppliment_mdn/
learnprogramming,1ge41so,Any good places for learning C#?,0,6,0,texto,Question,C,https://www.reddit.com/r/learnprogramming/comments/1ge41so/any_good_places_for_learning_c/
learnprogramming,1ge3qzn,Java or c#,39,57,0,texto,,Java,https://www.reddit.com/r/learnprogramming/comments/1ge3qzn/java_or_c/
learnprogramming,1ge3gps,include iostream error c++,0,2,0,texto,Debugging,C,https://www.reddit.com/r/learnprogramming/comments/1ge3gps/include_iostream_error_c/
learnprogramming,1ge3ckv,Bro Is machine learning the new Web dev ?,0,23,0,texto,,Outros,https://www.reddit.com/r/learnprogramming/comments/1ge3ckv/bro_is_machine_learning_the_new_web_dev/
learnprogramming,1ge302p,I'm learning web dev which language should I start DSA,0,4,0,texto,,Outros,https://www.reddit.com/r/learnprogramming/comments/1ge302p/im_learning_web_dev_which_language_should_i_start/
learnprogramming,1ge2nn1,Problems with the Otriviata API,1,0,0,texto,,Outros,https://www.reddit.com/r/learnprogramming/comments/1ge2nn1/problems_with_the_otriviata_api/
learnprogramming,1ge2a3g,[JavaScript] console.log() output isn't appearing in the browser inspect.,1,2,0,texto,,JavaScript,https://www.reddit.com/r/learnprogramming/comments/1ge2a3g/javascript_consolelog_output_isnt_appearing_in/
learnprogramming,1ge1ubc,What forms of file transfer are available in IoT projects?,0,4,0,texto,,Outros,https://www.reddit.com/r/learnprogramming/comments/1ge1ubc/what_forms_of_file_transfer_are_available_in_iot/
learnprogramming,1ge1qbt,"[Python] ""AttributeError: can't set attribute"" showing up for one file but not another",1,2,0,texto,Solved,Python,https://www.reddit.com/r/learnprogramming/comments/1ge1qbt/python_attributeerror_cant_set_attribute_showing/
learnprogramming,1ge131v,I really want programming to be my job in the future,136,50,0,texto,Topic,Outros,https://www.reddit.com/r/learnprogramming/comments/1ge131v/i_really_want_programming_to_be_my_job_in_the/
learnprogramming,1ge0kli,How do I keep myself updated with Dev news ? ,4,5,0,texto,,Outros,https://www.reddit.com/r/learnprogramming/comments/1ge0kli/how_do_i_keep_myself_updated_with_dev_news/
learnprogramming,1ge0asd,A frontend engineer transitioning to backend-focused technologies. Any advice?,2,6,0,texto,Topic,Outros,https://www.reddit.com/r/learnprogramming/comments/1ge0asd/a_frontend_engineer_transitioning_to/
learnprogramming,1gdzleo,Using js libraries with Framer,1,0,0,texto,,Js,https://www.reddit.com/r/learnprogramming/comments/1gdzleo/using_js_libraries_with_framer/
learnprogramming,1gdzg0l,How to understand algorithms. Or how to write code?,1,9,0,texto,,Outros,https://www.reddit.com/r/learnprogramming/comments/1gdzg0l/how_to_understand_algorithms_or_how_to_write_code/
learnprogramming,1gdyh13,WPF user analytics,0,3,0,texto,,Outros,https://www.reddit.com/r/learnprogramming/comments/1gdyh13/wpf_user_analytics/
learnprogramming,1gdxg9v,Feature-Sliced Design in Front-End Development: What Are Your Experiences and Tips?,1,0,0,texto,Topic,Outros,https://www.reddit.com/r/learnprogramming/comments/1gdxg9v/featuresliced_design_in_frontend_development_what/
learnprogramming,1gdw6zh,Is this security measure worth the work?,0,8,0,texto,,Outros,https://www.reddit.com/r/learnprogramming/comments/1gdw6zh/is_this_security_measure_worth_the_work/
learnprogramming,1gdw2ri,What are some potential Ph.D. research topics in the field of IoT that have not been extensively studied yet?,37,33,0,texto,Topic,Outros,https://www.reddit.com/r/learnprogramming/comments/1gdw2ri/what_are_some_potential_phd_research_topics_in/
learnprogramming,1gdw29k,Any for advice for someone learning the MERN stack.,1,3,0,texto,,Outros,https://www.reddit.com/r/learnprogramming/comments/1gdw29k/any_for_advice_for_someone_learning_the_mern_stack/
learnprogramming,1gdvurs,the best path to learn to program,10,5,0,texto,,Outros,https://www.reddit.com/r/learnprogramming/comments/1gdvurs/the_best_path_to_learn_to_program/
learnprogramming,1gduwig,Tech boot camp help needed,0,10,0,texto,,Outros,https://www.reddit.com/r/learnprogramming/comments/1gduwig/tech_boot_camp_help_needed/
learnprogramming,1gdutpb,Why is Llama failing where OpenAI works just fine? (code),0,3,0,texto,Debugging,Outros,https://www.reddit.com/r/learnprogramming/comments/1gdutpb/why_is_llama_failing_where_openai_works_just_fine/
learnprogramming,1gduqrd,Unknown issue of casting to number failure,2,5,0,texto,,Outros,https://www.reddit.com/r/learnprogramming/comments/1gduqrd/unknown_issue_of_casting_to_number_failure/
learnprogramming,1gduncw,Should use Python my automations instead of using NoCode/LowCode?,3,3,0,texto,,Python,https://www.reddit.com/r/learnprogramming/comments/1gduncw/should_use_python_my_automations_instead_of_using/
learnprogramming,1gdul06,Books for SPL,2,2,0,texto,,Outros,https://www.reddit.com/r/learnprogramming/comments/1gdul06/books_for_spl/
learnprogramming,1gdn8ko,Feeling stuck and discouraged,1,0,0,texto,,Outros,https://www.reddit.com/r/learnprogramming/comments/1gdn8ko/feeling_stuck_and_discouraged/
learnprogramming,1gdueh8,Resources for my weird post-beginner level,5,7,0,texto,,Outros,https://www.reddit.com/r/learnprogramming/comments/1gdueh8/resources_for_my_weird_postbeginner_level/
learnprogramming,1gdtxmy,Stepped in The Clif Of Confusion :(,5,2,0,texto,,Outros,https://www.reddit.com/r/learnprogramming/comments/1gdtxmy/stepped_in_the_clif_of_confusion/
learnprogramming,1gdsqc0,I feel stuck as a senior engineer,21,33,0,texto,,Outros,https://www.reddit.com/r/learnprogramming/comments/1gdsqc0/i_feel_stuck_as_a_senior_engineer/
learnprogramming,1gdsem2,Lessons just blur together sometimes,1,2,0,texto,,Outros,https://www.reddit.com/r/learnprogramming/comments/1gdsem2/lessons_just_blur_together_sometimes/
learnprogramming,1gds6c6,TripleTen,2,3,0,texto,Topic,Outros,https://www.reddit.com/r/learnprogramming/comments/1gds6c6/tripleten/
learnprogramming,1gdrrr3,Not good at anything,13,19,0,texto,,Outros,https://www.reddit.com/r/learnprogramming/comments/1gdrrr3/not_good_at_anything/
learnprogramming,1gdrn20,Help with APIâ€™s,2,4,0,texto,Tutorial,Outros,https://www.reddit.com/r/learnprogramming/comments/1gdrn20/help_with_apis/
learnprogramming,1gdqzxi,Is Code academy worth it? ,0,11,0,texto,,Outros,https://www.reddit.com/r/learnprogramming/comments/1gdqzxi/is_code_academy_worth_it/
learnprogramming,1gdq27a,Why should I return only x results at a time from a query instead of returning all the results and caching them on the server?,12,17,0,texto,,Outros,https://www.reddit.com/r/learnprogramming/comments/1gdq27a/why_should_i_return_only_x_results_at_a_time_from/
learnprogramming,1gdpmni,Learning for projects,9,7,0,texto,,Outros,https://www.reddit.com/r/learnprogramming/comments/1gdpmni/learning_for_projects/
learnprogramming,1gdowp0,Suggestion for a Feature!!,0,3,0,texto,,Outros,https://www.reddit.com/r/learnprogramming/comments/1gdowp0/suggestion_for_a_feature/
learnprogramming,1gdou96,Clock with custom time ,3,3,0,texto,,Outros,https://www.reddit.com/r/learnprogramming/comments/1gdou96/clock_with_custom_time/
learnprogramming,1gdnne3,How do I update chat history when user creates a new chat ?,0,3,0,texto,Debugging,Outros,https://www.reddit.com/r/learnprogramming/comments/1gdnne3/how_do_i_update_chat_history_when_user_creates_a/
learnprogramming,1gdmxrf,CVs that landed you jobs,47,18,0,texto,,Outros,https://www.reddit.com/r/learnprogramming/comments/1gdmxrf/cvs_that_landed_you_jobs/
learnprogramming,1gdlq8n,C++ stack pop operation cannot update the middle pointer correctly,2,2,0,texto,,C,https://www.reddit.com/r/learnprogramming/comments/1gdlq8n/c_stack_pop_operation_cannot_update_the_middle/
learnprogramming,1gdl066,Focusing a window with Tkinter,2,0,0,texto,Debugging,Outros,https://www.reddit.com/r/learnprogramming/comments/1gdl066/focusing_a_window_with_tkinter/
learnprogramming,1gdkmeg,Django - connect to -> Mariadb on Raspberry Pi (can't connect twice?),2,4,0,texto,,Outros,https://www.reddit.com/r/learnprogramming/comments/1gdkmeg/django_connect_to_mariadb_on_raspberry_pi_cant/
learnprogramming,1gdjiqq,Have I learnt enough and struggling to build projects independently ,2,5,0,texto,,Outros,https://www.reddit.com/r/learnprogramming/comments/1gdjiqq/have_i_learnt_enough_and_struggling_to_build/
learnprogramming,1gdj2tn,Learning python ,1,15,0,texto,,Python,https://www.reddit.com/r/learnprogramming/comments/1gdj2tn/learning_python/
learnprogramming,1gdimbn,Does anyone know of any coding problem that focus on maths topics,2,2,0,texto,,Outros,https://www.reddit.com/r/learnprogramming/comments/1gdimbn/does_anyone_know_of_any_coding_problem_that_focus/
learnprogramming,1gdii1v,Simple implementation of Conway's Game of Life,3,1,0,texto,,Outros,https://www.reddit.com/r/learnprogramming/comments/1gdii1v/simple_implementation_of_conways_game_of_life/
learnprogramming,1gdhvot,"Can't resolve SQL error: 'TLS/SSL error: SSL is required, but the server does not support it'",1,9,0,texto,,Outros,https://www.reddit.com/r/learnprogramming/comments/1gdhvot/cant_resolve_sql_error_tlsssl_error_ssl_is/
learnprogramming,1gdhupn,Music recognition app,3,4,0,texto,,Outros,https://www.reddit.com/r/learnprogramming/comments/1gdhupn/music_recognition_app/
learnprogramming,1gdhtvq,Has anyone here completed the Odin project? If so how was it,15,6,0,texto,,Outros,https://www.reddit.com/r/learnprogramming/comments/1gdhtvq/has_anyone_here_completed_the_odin_project_if_so/
learnprogramming,1gdght9,Why learn CS concepts such as OS & Networking for SWE? All software looks like basic CRUD apps where you copy and paste code from AI,0,16,0,texto,,Outros,https://www.reddit.com/r/learnprogramming/comments/1gdght9/why_learn_cs_concepts_such_as_os_networking_for/
learnprogramming,1gdgi62,What do you think of Cursor - The AI Code Editor?,0,11,0,texto,,Outros,https://www.reddit.com/r/learnprogramming/comments/1gdgi62/what_do_you_think_of_cursor_the_ai_code_editor/
learnprogramming,1gdga2p,Extract data from pop-up window,0,1,1,texto,,Outros,https://www.reddit.com/r/learnprogramming/comments/1gdga2p/extract_data_from_popup_window/
learnprogramming,1gdg75q,Third-Year CS Student with a 2.6 GPA and No Digital Skillsâ€”Should I Focus on Improving My GPA or Building Skills?,10,34,0,texto,,Outros,https://www.reddit.com/r/learnprogramming/comments/1gdg75q/thirdyear_cs_student_with_a_26_gpa_and_no_digital/
learnprogramming,1gdg338,Feel Overwhelmed After First Tutorial Project As A 1st Year,1,3,0,texto,,Outros,https://www.reddit.com/r/learnprogramming/comments/1gdg338/feel_overwhelmed_after_first_tutorial_project_as/
learnprogramming,1gdfzis,Which engineering blogs do you like reading and how do you stay up to date?,3,3,0,texto,,Outros,https://www.reddit.com/r/learnprogramming/comments/1gdfzis/which_engineering_blogs_do_you_like_reading_and/
learnprogramming,1gdf4et,Problem solving,2,5,0,texto,,Outros,https://www.reddit.com/r/learnprogramming/comments/1gdf4et/problem_solving/
learnprogramming,1gdezx8,The most starred GitHub repos are learning resources,88,9,0,texto,,Outros,https://www.reddit.com/r/learnprogramming/comments/1gdezx8/the_most_starred_github_repos_are_learning/
learnprogramming,1gdeutp,"I want to learn full stack Webdev, should I be using Javascript or Typescript?",3,10,0,texto,,JavaScript,https://www.reddit.com/r/learnprogramming/comments/1gdeutp/i_want_to_learn_full_stack_webdev_should_i_be/
learnprogramming,1gdejha,problem with matplotlib and vscode.  UserWarning: FigureCanvasAgg is non-interactive.   Online fixes haven't worked.,2,3,0,texto,,Outros,https://www.reddit.com/r/learnprogramming/comments/1gdejha/problem_with_matplotlib_and_vscode_userwarning/
learnprogramming,1gdehm5,I am afraid what I am doing isn't programming.,274,78,0,texto,,Outros,https://www.reddit.com/r/learnprogramming/comments/1gdehm5/i_am_afraid_what_i_am_doing_isnt_programming/
learnprogramming,1gde4ux,How to protect access to REST API,1,2,0,texto,,Outros,https://www.reddit.com/r/learnprogramming/comments/1gde4ux/how_to_protect_access_to_rest_api/
learnprogramming,1gddpcd,Should I learn Python in almost 2025 or go with Rust?,10,43,0,texto,,Python,https://www.reddit.com/r/learnprogramming/comments/1gddpcd/should_i_learn_python_in_almost_2025_or_go_with/
learnprogramming,1gddf2a,what error is this ?,0,2,0,texto,,Outros,https://www.reddit.com/r/learnprogramming/comments/1gddf2a/what_error_is_this/
learnprogramming,1gdcw25,"I'm wanting to do a project in Javascript, and another in Python for my resume. Any ideas?",1,5,0,texto,,Python,https://www.reddit.com/r/learnprogramming/comments/1gdcw25/im_wanting_to_do_a_project_in_javascript_and/
learnprogramming,1gdcvze,where to learn js?,0,17,0,texto,,Js,https://www.reddit.com/r/learnprogramming/comments/1gdcvze/where_to_learn_js/
learnprogramming,1gdc2tx,I made 2 version of the same code (50 lines each). I want all the feedback you can give me!,1,5,0,texto,Code Review,Outros,https://www.reddit.com/r/learnprogramming/comments/1gdc2tx/i_made_2_version_of_the_same_code_50_lines_each_i/
learnprogramming,1gdbt4s,Comp sci degree quickly when you already have experience in Canada?,3,14,0,texto,,Outros,https://www.reddit.com/r/learnprogramming/comments/1gdbt4s/comp_sci_degree_quickly_when_you_already_have/
learnprogramming,1gdaz7g,Free codeCamp,4,2,0,texto,,Outros,https://www.reddit.com/r/learnprogramming/comments/1gdaz7g/free_codecamp/
learnprogramming,1gdaw23,Is nodejs good?,1,7,0,texto,,Outros,https://www.reddit.com/r/learnprogramming/comments/1gdaw23/is_nodejs_good/
learnprogramming,1gd9pbk,I'm in a big dilema,0,14,0,texto,,Outros,https://www.reddit.com/r/learnprogramming/comments/1gd9pbk/im_in_a_big_dilema/
learnprogramming,1gd9eef,Building a Social Media Website with Django and React - Stuck on the Account Registration Process! Need a Roadmap,1,1,0,texto,,React,https://www.reddit.com/r/learnprogramming/comments/1gd9eef/building_a_social_media_website_with_django_and/
learnprogramming,1gd98yc,Any practical use case of Assembly? ,1,19,0,texto,,Assembly,https://www.reddit.com/r/learnprogramming/comments/1gd98yc/any_practical_use_case_of_assembly/
learnprogramming,1gd8hsb,"Which one did you find more stressful, frontend or backend?",51,77,0,texto,,Outros,https://www.reddit.com/r/learnprogramming/comments/1gd8hsb/which_one_did_you_find_more_stressful_frontend_or/
learnprogramming,1gd8f74,The realm of Data and workflow automation,2,2,0,texto,,Outros,https://www.reddit.com/r/learnprogramming/comments/1gd8f74/the_realm_of_data_and_workflow_automation/
learnprogramming,1gd7vbt,Feeling lost. Need help!,3,4,0,texto,,Outros,https://www.reddit.com/r/learnprogramming/comments/1gd7vbt/feeling_lost_need_help/
learnprogramming,1gd7fv9,When can I begin practicing questions?,1,2,0,texto,Topic,Outros,https://www.reddit.com/r/learnprogramming/comments/1gd7fv9/when_can_i_begin_practicing_questions/
learnprogramming,1gd7ask,Need help choosing between learning go or rust,2,12,0,texto,,Go,https://www.reddit.com/r/learnprogramming/comments/1gd7ask/need_help_choosing_between_learning_go_or_rust/
learnprogramming,1gd6q4u,How does route mapping work when using external HTTP server?,3,4,0,texto,Topic,Outros,https://www.reddit.com/r/learnprogramming/comments/1gd6q4u/how_does_route_mapping_work_when_using_external/
learnprogramming,1gd5yep,A program that can read two different integers and displays the larger value while also stating if it is an odd or even number. ,0,11,0,texto,Code Review,Outros,https://www.reddit.com/r/learnprogramming/comments/1gd5yep/a_program_that_can_read_two_different_integers/
learnprogramming,1gd5q89,Convert Python code to another language?,0,10,0,texto,Tutorial,Python,https://www.reddit.com/r/learnprogramming/comments/1gd5q89/convert_python_code_to_another_language/
learnprogramming,1gd5hwk,help,1,3,0,texto,Topic,Outros,https://www.reddit.com/r/learnprogramming/comments/1gd5hwk/help/
learnprogramming,1gd47wd,Can anyone verify that this project is safe to use?,0,2,0,texto,,Outros,https://www.reddit.com/r/learnprogramming/comments/1gd47wd/can_anyone_verify_that_this_project_is_safe_to_use/
learnprogramming,1gd3vjt,How to improve at programming ,14,13,0,texto,,Outros,https://www.reddit.com/r/learnprogramming/comments/1gd3vjt/how_to_improve_at_programming/
learnprogramming,1gd3uxf,Doubt regarding python course by mooc.fi,4,2,0,texto,,Python,https://www.reddit.com/r/learnprogramming/comments/1gd3uxf/doubt_regarding_python_course_by_moocfi/
learnprogramming,1gd3ju7,is it possible for a standalone system made from windows form app vb.net to be used online?,2,4,0,texto,Tutorial,Outros,https://www.reddit.com/r/learnprogramming/comments/1gd3ju7/is_it_possible_for_a_standalone_system_made_from/
learnprogramming,1gd27aw,Docker not correctly integrates with my website,3,12,0,texto,,Outros,https://www.reddit.com/r/learnprogramming/comments/1gd27aw/docker_not_correctly_integrates_with_my_website/
learnprogramming,1gd21l4,Pusher not firing messages,2,1,0,texto,,Outros,https://www.reddit.com/r/learnprogramming/comments/1gd21l4/pusher_not_firing_messages/
learnprogramming,1gd0he0,JavaScript should have a trigger warning for people with OCD,0,15,0,texto,,JavaScript,https://www.reddit.com/r/learnprogramming/comments/1gd0he0/javascript_should_have_a_trigger_warning_for/
learnprogramming,1gczymj,How hard is it to learn C# if I know basic C++ and Java?,21,15,0,texto,,Java,https://www.reddit.com/r/learnprogramming/comments/1gczymj/how_hard_is_it_to_learn_c_if_i_know_basic_c_and/
learnprogramming,1gcze0y,My App Goal/Project,2,4,0,texto,Topic,Outros,https://www.reddit.com/r/learnprogramming/comments/1gcze0y/my_app_goalproject/
learnprogramming,1gcyvud,How do I sync my ios app and pc app data thru internet?,2,4,0,texto,,Outros,https://www.reddit.com/r/learnprogramming/comments/1gcyvud/how_do_i_sync_my_ios_app_and_pc_app_data_thru/
learnprogramming,1gcyjd8,Course recommendations that delve into intermediate/advanced programming?,46,9,0,texto,,Outros,https://www.reddit.com/r/learnprogramming/comments/1gcyjd8/course_recommendations_that_delve_into/
learnprogramming,1gcxz5v,"I want to learn how to create games, so...",4,18,0,texto,doubt,Outros,https://www.reddit.com/r/learnprogramming/comments/1gcxz5v/i_want_to_learn_how_to_create_games_so/
learnprogramming,1gcwted,I want to build a chat application,2,5,0,texto,,Outros,https://www.reddit.com/r/learnprogramming/comments/1gcwted/i_want_to_build_a_chat_application/
learnprogramming,1gcw44r,I absolutely hate web and app dev. Don't know what to do.,112,60,0,texto,,Outros,https://www.reddit.com/r/learnprogramming/comments/1gcw44r/i_absolutely_hate_web_and_app_dev_dont_know_what/
learnprogramming,1gcvdun,Need help with this code c++,2,8,0,texto,,C,https://www.reddit.com/r/learnprogramming/comments/1gcvdun/need_help_with_this_code_c/
learnprogramming,1gcv9jl,Business logic: stored procedures vs backend,1,5,0,texto,Topic,Outros,https://www.reddit.com/r/learnprogramming/comments/1gcv9jl/business_logic_stored_procedures_vs_backend/
learnprogramming,1gcv3xy,Web Deployment,0,0,0,texto,,Outros,https://www.reddit.com/r/learnprogramming/comments/1gcv3xy/web_deployment/
learnprogramming,1gcuvcd,How to start,0,2,0,texto,,Outros,https://www.reddit.com/r/learnprogramming/comments/1gcuvcd/how_to_start/
learnprogramming,1gctvdc,"Challenges with creating  fullstack e-commerce app (academic) (sql,fastapi,react RTK)",1,1,0,texto,,React,https://www.reddit.com/r/learnprogramming/comments/1gctvdc/challenges_with_creating_fullstack_ecommerce_app/
learnprogramming,1gcsul1,I don't understand my keyboard ,0,7,0,texto,,Outros,https://www.reddit.com/r/learnprogramming/comments/1gcsul1/i_dont_understand_my_keyboard/
learnprogramming,1gcsazr,Looking for guidance on learning to build recommendation systems and matching algorithms for an E-commerce platform,4,0,0,texto,Help,Outros,https://www.reddit.com/r/learnprogramming/comments/1gcsazr/looking_for_guidance_on_learning_to_build/
learnprogramming,1gcqgqn,How to start?,0,6,0,texto,,Outros,https://www.reddit.com/r/learnprogramming/comments/1gcqgqn/how_to_start/
learnprogramming,1gcq9wp,How to use docker for running code in isolation? ,2,8,0,texto,Tutorial,Outros,https://www.reddit.com/r/learnprogramming/comments/1gcq9wp/how_to_use_docker_for_running_code_in_isolation/
learnprogramming,1gcq9gm,Increase my Data Structures and Algorithms knowledge,3,0,0,texto,,Outros,https://www.reddit.com/r/learnprogramming/comments/1gcq9gm/increase_my_data_structures_and_algorithms/
learnprogramming,1gcq71e,About React,0,5,0,texto,,React,https://www.reddit.com/r/learnprogramming/comments/1gcq71e/about_react/
learnprogramming,1gcpxn8,Integrating ClamAV into an Existing Virtual Studio Project,2,1,0,texto,Debugging,Outros,https://www.reddit.com/r/learnprogramming/comments/1gcpxn8/integrating_clamav_into_an_existing_virtual/
learnprogramming,1gcpijo,Harvard CS50 or the odin project?,16,13,0,texto,,Outros,https://www.reddit.com/r/learnprogramming/comments/1gcpijo/harvard_cs50_or_the_odin_project/
learnprogramming,1gcp8e3,Accessing Data From some Centralized Source in KQL,2,0,0,texto,KQL Help,Outros,https://www.reddit.com/r/learnprogramming/comments/1gcp8e3/accessing_data_from_some_centralized_source_in_kql/
learnprogramming,1gcp3m3,What's the best source to learn Big O Notation In Details?,8,5,0,texto,,Outros,https://www.reddit.com/r/learnprogramming/comments/1gcp3m3/whats_the_best_source_to_learn_big_o_notation_in/
learnprogramming,1gcopg2,Purpose as a dev,14,19,0,texto,,Outros,https://www.reddit.com/r/learnprogramming/comments/1gcopg2/purpose_as_a_dev/
learnprogramming,1gconte,"Which is the ""right"" OSSU ?",5,9,0,texto,,Outros,https://www.reddit.com/r/learnprogramming/comments/1gconte/which_is_the_right_ossu/
learnprogramming,1gcoked,Something about web development really discourages me.,113,69,0,texto,,Outros,https://www.reddit.com/r/learnprogramming/comments/1gcoked/something_about_web_development_really/
learnprogramming,1gcoafi,Correct me if I'm wrong: Bootcamps seem to teach things BACKWARDS. ,55,48,0,texto,,Outros,https://www.reddit.com/r/learnprogramming/comments/1gcoafi/correct_me_if_im_wrong_bootcamps_seem_to_teach/
learnprogramming,1gcncrv,What after basics?,2,5,0,texto,,Outros,https://www.reddit.com/r/learnprogramming/comments/1gcncrv/what_after_basics/
learnprogramming,1gcn7da,Build an AI trading model course â€” udacity ,0,1,0,texto,,Outros,https://www.reddit.com/r/learnprogramming/comments/1gcn7da/build_an_ai_trading_model_course_udacity/
learnprogramming,1gcn1hx,Proper way to handle anonymous users for e-comerce website,3,2,0,texto,,Outros,https://www.reddit.com/r/learnprogramming/comments/1gcn1hx/proper_way_to_handle_anonymous_users_for_ecomerce/
learnprogramming,1gcmqes,Why it is returning None,0,11,0,texto,Debugging,Outros,https://www.reddit.com/r/learnprogramming/comments/1gcmqes/why_it_is_returning_none/
learnprogramming,1gcmbme,Need some guidance over a project idea!!!,3,1,0,texto,,Outros,https://www.reddit.com/r/learnprogramming/comments/1gcmbme/need_some_guidance_over_a_project_idea/
learnprogramming,1gcm540,Faced this in an OA recently. Can anyone point out the correct answer?,2,8,0,texto,Debugging,Outros,https://www.reddit.com/r/learnprogramming/comments/1gcm540/faced_this_in_an_oa_recently_can_anyone_point_out/
learnprogramming,1gclm1t,Advice Needed: Developing AI-Driven International Flight Planner for College Project â€“ API Suggestions?,2,1,0,texto,,Outros,https://www.reddit.com/r/learnprogramming/comments/1gclm1t/advice_needed_developing_aidriven_international/
learnprogramming,1gcknv8,Tips for learning?,9,8,0,texto,,Outros,https://www.reddit.com/r/learnprogramming/comments/1gcknv8/tips_for_learning/
learnprogramming,1gckn4y,2â€™s complement,2,10,0,texto,,Outros,https://www.reddit.com/r/learnprogramming/comments/1gckn4y/2s_complement/
learnprogramming,1gcjl4c,Anyone have good resources for learning to write code? specifically TS?,4,2,0,texto,,Outros,https://www.reddit.com/r/learnprogramming/comments/1gcjl4c/anyone_have_good_resources_for_learning_to_write/
learnprogramming,1gciz4e,Real time desktop audio analysis,2,2,0,texto,Audio,Outros,https://www.reddit.com/r/learnprogramming/comments/1gciz4e/real_time_desktop_audio_analysis/
learnprogramming,1gcitek,Any site that has code challenge similar to backend  job coding assessment?,2,3,0,texto,,Outros,https://www.reddit.com/r/learnprogramming/comments/1gcitek/any_site_that_has_code_challenge_similar_to/
learnprogramming,1gcif9t,Writing a chip 8 emulator ,2,1,0,texto,,Outros,https://www.reddit.com/r/learnprogramming/comments/1gcif9t/writing_a_chip_8_emulator/
learnprogramming,1gchpmy,Need Help with DSA ,8,7,0,texto,Resource,Outros,https://www.reddit.com/r/learnprogramming/comments/1gchpmy/need_help_with_dsa/
