subreddit,post_id,titulo,upvotes,comentarios,compartilhamentos,formato,tags,linguagem,url
webdev,1gjetju,This is Vim-Restman a Postman alternative in Vim!,6,2,0,texto,Resource,Outros,https://www.reddit.com/r/webdev/comments/1gjetju/this_is_vimrestman_a_postman_alternative_in_vim/
webdev,1gjehqz,Exploring the browser rendering process in an interactive way,5,1,0,texto,Resource,Outros,https://www.reddit.com/r/webdev/comments/1gjehqz/exploring_the_browser_rendering_process_in_an/
webdev,1gjec0o,A little rant on Tailwind,283,714,0,texto,,Outros,https://www.reddit.com/r/webdev/comments/1gjec0o/a_little_rant_on_tailwind/
webdev,1gje6gh,Spring Security CSRF token not recognized ${_csrf.token},3,3,0,texto,Question,Outros,https://www.reddit.com/r/webdev/comments/1gje6gh/spring_security_csrf_token_not_recognized/
webdev,1gjdrx1,If You Were An Idiot Like Me...,44,29,0,texto,,Outros,https://www.reddit.com/r/webdev/comments/1gjdrx1/if_you_were_an_idiot_like_me/
webdev,1gjdpi1,What's a good price for converting a website to a mobile app?,0,6,0,texto,Question,Outros,https://www.reddit.com/r/webdev/comments/1gjdpi1/whats_a_good_price_for_converting_a_website_to_a/
webdev,1gjd7sw,Part time job hourly rate. Is it lower than usual job hourly rate?,9,8,0,texto,,Outros,https://www.reddit.com/r/webdev/comments/1gjd7sw/part_time_job_hourly_rate_is_it_lower_than_usual/
webdev,1gjd58i,My company is offering a budget for tools and courses to help us grow as devsâ€”any recommendations?,7,10,0,texto,Question,Outros,https://www.reddit.com/r/webdev/comments/1gjd58i/my_company_is_offering_a_budget_for_tools_and/
webdev,1gjd35i,The the tech stack i used for my blog,0,0,0,texto,,Outros,https://www.reddit.com/r/webdev/comments/1gjd35i/the_the_tech_stack_i_used_for_my_blog/
webdev,1gjcnx6,My recipe extractor app,8,13,0,texto,,Outros,https://www.reddit.com/r/webdev/comments/1gjcnx6/my_recipe_extractor_app/
webdev,1gjabm7,is shadcn over complicated and difficult to use?,0,52,0,texto,Discussion,Outros,https://www.reddit.com/r/webdev/comments/1gjabm7/is_shadcn_over_complicated_and_difficult_to_use/
webdev,1gja9pr,HELP! Is there a tool I can use to present and frequently update a relationships network on a website? ,1,3,0,texto,Question,Outros,https://www.reddit.com/r/webdev/comments/1gja9pr/help_is_there_a_tool_i_can_use_to_present_and/
webdev,1gja8t3,Squareup vs WooCommerce for Takeaway business UK,1,0,0,texto,,Outros,https://www.reddit.com/r/webdev/comments/1gja8t3/squareup_vs_woocommerce_for_takeaway_business_uk/
webdev,1gj7q79,My first website with Gsap,146,103,0,texto,,Outros,https://www.reddit.com/r/webdev/comments/1gj7q79/my_first_website_with_gsap/
webdev,1gj74fy,New Swagger-UI embedding Cloud TypeScript Editor with SDK,1,0,0,link,Article,TypeScript,https://nestia.io/articles/new-swagger-ui-combined-with-cloud-typescript-editor-with-embedded-sdk.html
webdev,1gj3crn,Roast tf out of my portfolio. ,0,77,0,texto,,Outros,https://www.reddit.com/r/webdev/comments/1gj3crn/roast_tf_out_of_my_portfolio/
webdev,1gj22mx,Looking for feedback on my first site please,2,10,0,texto,Discussion,Outros,https://www.reddit.com/r/webdev/comments/1gj22mx/looking_for_feedback_on_my_first_site_please/
webdev,1giyrld,Thoughts on Astro framework? ,29,33,0,texto,,Outros,https://www.reddit.com/r/webdev/comments/1giyrld/thoughts_on_astro_framework/
webdev,1gixcyy,Someone wants to buy my project and is offering me a job,183,120,0,texto,Question,Outros,https://www.reddit.com/r/webdev/comments/1gixcyy/someone_wants_to_buy_my_project_and_is_offering/
webdev,1gix3y7,How to embed a map into my app to track buses.,1,6,0,texto,Question,Outros,https://www.reddit.com/r/webdev/comments/1gix3y7/how_to_embed_a_map_into_my_app_to_track_buses/
webdev,1gix3r6,"Chrome/Google flags my fresh Wordpress install as a ""Dangerous Page"", help?",7,8,0,texto,,Outros,https://www.reddit.com/r/webdev/comments/1gix3r6/chromegoogle_flags_my_fresh_wordpress_install_as/
webdev,1giwqga,Home Network Programming,2,9,0,texto,,Outros,https://www.reddit.com/r/webdev/comments/1giwqga/home_network_programming/
webdev,1giwkfh,I made a 3D Text Editor in React from Scratch,0,0,0,texto,,React,https://www.reddit.com/r/webdev/comments/1giwkfh/i_made_a_3d_text_editor_in_react_from_scratch/
webdev,1giwgkf,Is this stupid?,10,4,0,texto,Question,Outros,https://www.reddit.com/r/webdev/comments/1giwgkf/is_this_stupid/
webdev,1giw83t,Laravel Under The Hood - A Little Bit of Macros,2,0,0,texto,Article,Outros,https://www.reddit.com/r/webdev/comments/1giw83t/laravel_under_the_hood_a_little_bit_of_macros/
webdev,1girpoz,Should I put npm packages on resume?,60,23,0,link,,Outros,https://npmjs.com/package/string-sure
webdev,1girood,Creating a Simple Food Allergy-Friendly Website with QR Codes,1,7,0,texto,,Outros,https://www.reddit.com/r/webdev/comments/1girood/creating_a_simple_food_allergyfriendly_website/
webdev,1giri5m,Sample Set of Product Images,1,3,0,texto,,Outros,https://www.reddit.com/r/webdev/comments/1giri5m/sample_set_of_product_images/
webdev,1giqup1,"As a Full stack web Dev, what's your salary and what Stack do you use. ",89,90,0,texto,,Outros,https://www.reddit.com/r/webdev/comments/1giqup1/as_a_full_stack_web_dev_whats_your_salary_and/
webdev,1giq3t6,What would be the best way to run a server alongside Next.js project?,5,14,0,texto,,Js,https://www.reddit.com/r/webdev/comments/1giq3t6/what_would_be_the_best_way_to_run_a_server/
webdev,1gipm86,Can I get some feedback on my portfolio,5,36,0,link,Discussion,Outros,https://charles-portfolio-7vi.pages.dev/
webdev,1gipg9l,Why website lags on scroll,0,17,0,texto,,Outros,https://www.reddit.com/r/webdev/comments/1gipg9l/why_website_lags_on_scroll/
webdev,1giozs7,Anyone working with Twitterâ€™s API?,0,6,0,texto,Discussion,Outros,https://www.reddit.com/r/webdev/comments/1giozs7/anyone_working_with_twitters_api/
webdev,1giotfx,Check out my portfolio,21,29,0,texto,,Outros,https://www.reddit.com/r/webdev/comments/1giotfx/check_out_my_portfolio/
webdev,1giohsa,Frustration from progression as a developer (skill issue maybe?),5,3,0,texto,Discussion,Outros,https://www.reddit.com/r/webdev/comments/1giohsa/frustration_from_progression_as_a_developer_skill/
webdev,1gioadj,Build up your confidence with Regex: 5 Techniques to make it STICK,13,9,0,texto,Resource,Outros,https://www.reddit.com/r/webdev/comments/1gioadj/build_up_your_confidence_with_regex_5_techniques/
webdev,1gim7vo,Fragmented Communication Survey - How do you manage the chaos of multiple messaging apps? (5-7 min survey),0,0,0,texto,,Outros,https://www.reddit.com/r/webdev/comments/1gim7vo/fragmented_communication_survey_how_do_you_manage/
webdev,1gil7cl,How to do the scatter effect in react tailwind or css,1,17,0,texto,Question,React,https://www.reddit.com/r/webdev/comments/1gil7cl/how_to_do_the_scatter_effect_in_react_tailwind_or/
webdev,1gikjcx,How much would you charge for a comprehensive mentoring platform? (Wordpress),0,21,0,texto,,Outros,https://www.reddit.com/r/webdev/comments/1gikjcx/how_much_would_you_charge_for_a_comprehensive/
webdev,1gijssf,How much do you make as a web dev?,302,581,0,texto,Question,Outros,https://www.reddit.com/r/webdev/comments/1gijssf/how_much_do_you_make_as_a_web_dev/
webdev,1gij7y1,Open-source Doodle alternative as project for my thesis,3,0,0,texto,Question,Outros,https://www.reddit.com/r/webdev/comments/1gij7y1/opensource_doodle_alternative_as_project_for_my/
webdev,1giight,can anyone help me create this design ,0,21,0,link,,Outros,https://i.redd.it/hihsulfjenyd1.png
webdev,1gihgq3,Seeking Feedback on a Smart Classroom Notification System Project,1,1,0,texto,,Outros,https://www.reddit.com/r/webdev/comments/1gihgq3/seeking_feedback_on_a_smart_classroom/
webdev,1gigjso,Advice form my e-library,1,5,0,texto,,Outros,https://www.reddit.com/r/webdev/comments/1gigjso/advice_form_my_elibrary/
webdev,1gighqy,Made a P2P file share,20,7,0,link,Showoff Saturday,Outros,https://app.jeigsaw.xyz/peer-share
webdev,1gig2qr,"Sharing a project I'm working on, a social media networking web application",2,18,0,texto,Showoff Saturday,Outros,https://www.reddit.com/r/webdev/comments/1gig2qr/sharing_a_project_im_working_on_a_social_media/
webdev,1gife5d,How much should I have charged for this website? ,0,17,0,texto,Question,Outros,https://www.reddit.com/r/webdev/comments/1gife5d/how_much_should_i_have_charged_for_this_website/
webdev,1giebqt,I built a coding platform as a pet project,0,5,0,texto,,Outros,https://www.reddit.com/r/webdev/comments/1giebqt/i_built_a_coding_platform_as_a_pet_project/
webdev,1gie3hh,Fixing FOUC as user,3,10,0,texto,,Outros,https://www.reddit.com/r/webdev/comments/1gie3hh/fixing_fouc_as_user/
webdev,1giad79,"Wordpress blog + membership site, keep on main domain or sub domain?",0,5,0,texto,,Outros,https://www.reddit.com/r/webdev/comments/1giad79/wordpress_blog_membership_site_keep_on_main/
webdev,1gi9pv6,WP he best Headless CMS Choice in 2024?,2,28,0,texto,Discussion,Outros,https://www.reddit.com/r/webdev/comments/1gi9pv6/wp_he_best_headless_cms_choice_in_2024/
webdev,1gi9dqy,building website builder for developers,0,28,0,link,Showoff Saturday,Outros,https://i.redd.it/cawems6unkyd1.png
webdev,1gi8ind,Code Groupie: Explore Hundreds of Open Source Projects,25,2,0,link,Showoff Saturday,Outros,https://www.reddit.com/gallery/1gi8ind
webdev,1gi89c6,Website development testing checklist,3,0,0,texto,Question,Outros,https://www.reddit.com/r/webdev/comments/1gi89c6/website_development_testing_checklist/
webdev,1gi7nsv,How to find github projects to contribute?,18,14,0,texto,Discussion,Outros,https://www.reddit.com/r/webdev/comments/1gi7nsv/how_to_find_github_projects_to_contribute/
webdev,1gi6d94,"Introducing TargetJ: A Unified Framework for Events, Animations, API Calls, and More
",1,1,0,texto,Showoff Saturday,Outros,https://www.reddit.com/r/webdev/comments/1gi6d94/introducing_targetj_a_unified_framework_for/
webdev,1gi3vpz,"syntax error, unexpected identifier",0,5,0,texto,,Outros,https://www.reddit.com/r/webdev/comments/1gi3vpz/syntax_error_unexpected_identifier/
webdev,1gi3ld9,hosting in github pages first time,2,8,0,texto,Question,Outros,https://www.reddit.com/r/webdev/comments/1gi3ld9/hosting_in_github_pages_first_time/
webdev,1gi3jib,Front end portfolio advice wanted for beginner in industry,3,6,0,texto,Question,Outros,https://www.reddit.com/r/webdev/comments/1gi3jib/front_end_portfolio_advice_wanted_for_beginner_in/
webdev,1gi3gso,I created free Facebook Ad Maker,0,1,0,link,Showoff Saturday,Outros,https://www.reddit.com/gallery/1gi3gso
webdev,1gi3ek9,I've been developing a simple widget app for feedback collecting! ,49,24,0,link,,Outros,https://i.redd.it/i811n0suajyd1.png
webdev,1gi3cg0,Opinions on Svelte and SvelteKit?,5,24,0,texto,,Outros,https://www.reddit.com/r/webdev/comments/1gi3cg0/opinions_on_svelte_and_sveltekit/
webdev,1gi36ah,I built redoit.app a cute and minimal habit tracker [Open Source],223,16,0,link,Showoff Saturday,Outros,https://i.redd.it/kdgwizej6jyd1.gif
webdev,1gi2woj,Im building a computer vision website. looking for landing page feedback,9,20,0,link,,Outros,https://i.redd.it/i8v0lr5y6jyd1.jpeg
webdev,1gi2uep,Play the current date and time as piano music,1,0,0,link,Showoff Saturday,Outros,https://lab.aizastudio.com/chrono-piano
webdev,1gi1ya7,Show more vs. regional scroll behavior vs. something else,1,0,0,texto,,Outros,https://www.reddit.com/r/webdev/comments/1gi1ya7/show_more_vs_regional_scroll_behavior_vs/
webdev,1gi1vzn,I have a startup idea and need to build an e-commerce website ,0,12,0,texto,Discussion,Outros,https://www.reddit.com/r/webdev/comments/1gi1vzn/i_have_a_startup_idea_and_need_to_build_an/
webdev,1gi1thq, What does your planlook like before coding a new project?,7,21,0,texto,Discussion,Outros,https://www.reddit.com/r/webdev/comments/1gi1thq/what_does_your_planlook_like_before_coding_a_new/
webdev,1gi1c3v,"Building my portfolio took me a year, tell me what you think",11,10,0,link,Showoff Saturday,Outros,https://i.redd.it/27fwpplauiyd1.png
webdev,1gi1a71,forms and banner alerts without having to update your site,0,0,0,texto,,Outros,https://www.reddit.com/r/webdev/comments/1gi1a71/forms_and_banner_alerts_without_having_to_update/
webdev,1gi16he,Sign in to confirm youâ€™re not a bot with Youtube,2,3,0,texto,,Outros,https://www.reddit.com/r/webdev/comments/1gi16he/sign_in_to_confirm_youre_not_a_bot_with_youtube/
webdev,1gi16g2,Advice for my e-library,1,0,0,texto,,Outros,https://www.reddit.com/r/webdev/comments/1gi16g2/advice_for_my_elibrary/
webdev,1gi118y,"I made braucode.com, a tool to help you understand typescript projects on GitHub by letting you browse the whole codebase arranged in functionalities and concepts. Example screenshot of VSCode chat functionality",14,3,0,link,,TypeScript,https://i.redd.it/jzzuvd1wriyd1.png
webdev,1gi0wiw,PlaceYour.Vote: Cast Your Vote for the U.S. Presidential Election,0,1,0,texto,,Outros,https://www.reddit.com/r/webdev/comments/1gi0wiw/placeyourvote_cast_your_vote_for_the_us/
webdev,1gi0sta,Local Vector Database in Raw TS: No Docker or Server Needed!,1,0,0,texto,Showoff Saturday,Outros,https://www.reddit.com/r/webdev/comments/1gi0sta/local_vector_database_in_raw_ts_no_docker_or/
webdev,1gi0kur,Questions about a certain website,0,1,0,texto,Discussion,Outros,https://www.reddit.com/r/webdev/comments/1gi0kur/questions_about_a_certain_website/
webdev,1gi0k1n,1000 + apps no interviews ,0,17,0,texto,,Outros,https://www.reddit.com/r/webdev/comments/1gi0k1n/1000_apps_no_interviews/
webdev,1gi0a0q,Roast tf out of my portfolio,35,74,0,texto,Showoff Saturday,Outros,https://www.reddit.com/r/webdev/comments/1gi0a0q/roast_tf_out_of_my_portfolio/
webdev,1ghzh77,I made a Chrome Extension for Google Maps to organize your trips,53,9,0,link,Showoff Saturday,Outros,https://www.reddit.com/gallery/1ghzh77
webdev,1ghz9jl,I rebuilt my first website (an AI expense tracker),0,2,0,texto,Showoff Saturday,Outros,https://www.reddit.com/r/webdev/comments/1ghz9jl/i_rebuilt_my_first_website_an_ai_expense_tracker/
webdev,1ghz64n,Best way to build my business website,0,21,0,texto,Question,Outros,https://www.reddit.com/r/webdev/comments/1ghz64n/best_way_to_build_my_business_website/
webdev,1ghyhmw,Engineers Do Not Get To Make Startup Mistakes When They Build Ledgers,0,3,0,link,,Outros,https://news.alvaroduran.com/p/engineers-do-not-get-to-make-startup
webdev,1ghxvo2,"My first fullstack web app, allowing you to post your pet or interact with others! ",136,37,0,link,Showoff Saturday,Outros,https://i.redd.it/0223jfx92iyd1.png
webdev,1ghxkzp,I built a Privacy-Focused Grammarly alternative that runs entirely in your browser!,36,11,0,texto,Showoff Saturday,Outros,https://www.reddit.com/r/webdev/comments/1ghxkzp/i_built_a_privacyfocused_grammarly_alternative/
webdev,1ghxbwj,"I have two problems in two of my pages of my basic site. The first is in my home page, with the H2's positioning following flex additions to the main content. The second is a gallery page where I applied a grid, but something happened with the images area which resulted in a jumbled mess. Any fixes?",0,7,0,link,,Outros,https://www.reddit.com/gallery/1ghxbwj
webdev,1ghwd68,navlinks are sliding down but it's not the background color that I want?,0,2,0,texto,,Outros,https://www.reddit.com/r/webdev/comments/1ghwd68/navlinks_are_sliding_down_but_its_not_the/
webdev,1ghw5ta,Roast my landing page,0,8,0,texto,Showoff Saturday,Outros,https://www.reddit.com/r/webdev/comments/1ghw5ta/roast_my_landing_page/
webdev,1ghw0vv,I'm new to webdev learned basic JS Stuck in Tutorial Hell.,0,18,0,texto,Question,Js,https://www.reddit.com/r/webdev/comments/1ghw0vv/im_new_to_webdev_learned_basic_js_stuck_in/
webdev,1ghuvso,'Authorization' Header Get Stripped on Apache/Ubuntu 24.04,2,2,0,texto,,Outros,https://www.reddit.com/r/webdev/comments/1ghuvso/authorization_header_get_stripped_on_apacheubuntu/
webdev,1ghutck,"I build a ""portfolio page builder"" with pure CSS && JavaScript",0,11,0,link,Showoff Saturday,JavaScript,https://i.redd.it/i346plxj9hyd1.gif
webdev,1ghu8x8,Open-Source Alternative to Google Sign-In That Respects Your Privacy,0,2,0,texto,Discussion,Outros,https://www.reddit.com/r/webdev/comments/1ghu8x8/opensource_alternative_to_google_signin_that/
webdev,1ghu08u,Hobbies outside of coding? ,176,428,0,texto,,Outros,https://www.reddit.com/r/webdev/comments/1ghu08u/hobbies_outside_of_coding/
webdev,1ghtq2e,I've made an AI Website Builder that generates website from a single prompt,0,8,0,link,Showoff Saturday,Outros,https://i.redd.it/tfid4p2twgyd1.gif
webdev,1ghtc5l,What would you do in my situation? I built a moving / removals website for a laugh and have started to get calls / enquiries!,7,37,0,texto,Question,Outros,https://www.reddit.com/r/webdev/comments/1ghtc5l/what_would_you_do_in_my_situation_i_built_a/
webdev,1ghswg9,Today I IMPROVED THE EFFIENCY of one old script by 40X            | Check your old code!,297,49,0,texto,Article,Outros,https://www.reddit.com/r/webdev/comments/1ghswg9/today_i_improved_the_effiency_of_one_old_script/
webdev,1ghsw2v, Seeking Advice on Securing a Node.js API and SQL Database for a Small WPF Desktop App,2,0,0,texto,,Js,https://www.reddit.com/r/webdev/comments/1ghsw2v/seeking_advice_on_securing_a_nodejs_api_and_sql/
webdev,1ghs46u,"Made a social media type site, for anyone who likes to doodle.",21,10,0,link,Showoff Saturday,Outros,https://i.redd.it/adf0mn4qagyd1.png
webdev,1ghrzav,GIF  and Emoji picker,0,3,0,texto,Discussion,Outros,https://www.reddit.com/r/webdev/comments/1ghrzav/gif_and_emoji_picker/
webdev,1ghrezh,Changing from Sheets to web app?,2,1,0,texto,,Outros,https://www.reddit.com/r/webdev/comments/1ghrezh/changing_from_sheets_to_web_app/
webdev,1ghra1e,Rate my first ever landing page!,6,4,0,link,,Outros,https://i.redd.it/2gukh52iyfyd1.png
webdev,1ghqz65,I made a site for careers in AI as a fun side project,1,0,0,texto,Showoff Saturday,Outros,https://www.reddit.com/r/webdev/comments/1ghqz65/i_made_a_site_for_careers_in_ai_as_a_fun_side/
webdev,1ghqyht,Ethical question about being in contact with clients of an agency I previously worked at,8,10,0,texto,Discussion,Outros,https://www.reddit.com/r/webdev/comments/1ghqyht/ethical_question_about_being_in_contact_with/
webdev,1ghqhqh,Blitz Search - aims to better Find-in-files in VSCode,0,0,0,link,Showoff Saturday,Outros,https://i.redd.it/x0ktx3bonfyd1.jpeg
webdev,1ghq86e,Free Downtime & Speed monitoring,8,11,0,link,Showoff Saturday,Outros,https://i.redd.it/0jey188gjfyd1.gif
webdev,1ghq0h4,Kirby CMS Headless Question,2,3,0,texto,,Outros,https://www.reddit.com/r/webdev/comments/1ghq0h4/kirby_cms_headless_question/
webdev,1ghptoc,How to connect Docker container's terminal to front end?,1,4,0,texto,,Outros,https://www.reddit.com/r/webdev/comments/1ghptoc/how_to_connect_docker_containers_terminal_to/
webdev,1ghpq51,Not rendering full page if I scroll down too fast. ,0,4,0,link,,Outros,https://i.redd.it/cw9jgz9qdfyd1.jpeg
webdev,1ghpema,[Showoff Saturday] Roads Audio: Your Own Private Podcast with Friends,1,0,0,texto,Showoff Saturday,Outros,https://www.reddit.com/r/webdev/comments/1ghpema/showoff_saturday_roads_audio_your_own_private/
webdev,1ghp1wm,Building with a wordpress website,0,12,0,texto,Question,Outros,https://www.reddit.com/r/webdev/comments/1ghp1wm/building_with_a_wordpress_website/
webdev,1ghmud8,Open-sourced QueryFlip: The search router we needed,0,3,0,texto,,Outros,https://www.reddit.com/r/webdev/comments/1ghmud8/opensourced_queryflip_the_search_router_we_needed/
webdev,1ghlz25,"Fucking hate this. It scrolls into eternity and you have to deselect them one by one. Tf does ""legitimate interest"" even mean?",425,86,0,link,,Outros,https://i.redd.it/wdyyb1pcaeyd1.png
webdev,1ghkrf7,Real time text chat,2,10,1,texto,,Outros,https://www.reddit.com/r/webdev/comments/1ghkrf7/real_time_text_chat/
webdev,1ghjpzu,"Just finished getting a new WordPress website up. Why does Chrome say it is ""Dangerous!"" ?",0,7,0,texto,,Outros,https://www.reddit.com/r/webdev/comments/1ghjpzu/just_finished_getting_a_new_wordpress_website_up/
webdev,1ghj2k9,I created a tool that promotes your websiteâ€™s reliability instantly,25,20,0,link,Showoff Saturday,Outros,https://i.redd.it/oqkv0aigkdyd1.gif
webdev,1ghiusu,Interviewing at MAANG is stupid and broken,193,77,0,texto,,Outros,https://www.reddit.com/r/webdev/comments/1ghiusu/interviewing_at_maang_is_stupid_and_broken/
webdev,1ghht4b,I made a tool to generate Git Commit Summary from your CLI (no API key needed),45,16,0,link,Showoff Saturday,Outros,https://i.redd.it/dbawm5iw9dyd1.gif
webdev,1ghhrsq,Test your website in Lighthouse wars!,3,3,0,link,,Outros,https://lighthousewars.app/
webdev,1ghhe59,What do you think of this ? ,0,6,0,texto,Question,Outros,https://www.reddit.com/r/webdev/comments/1ghhe59/what_do_you_think_of_this/
webdev,1ggy5tz,A strange bug encountered in CSS.,1,0,0,texto,,Outros,https://www.reddit.com/r/webdev/comments/1ggy5tz/a_strange_bug_encountered_in_css/
webdev,1ghgwnk,"I have built a free online tool for generating and downloading beautiful color palettes in Hex and Pantone from Images, hex codes, and 700+ listed color names",29,5,0,link,Showoff Saturday,Outros,https://www.reddit.com/gallery/1ghgwnk
webdev,1ghg6gb,Koa or Express?,7,18,0,texto,Question,Outros,https://www.reddit.com/r/webdev/comments/1ghg6gb/koa_or_express/
webdev,1ghec7j,Resource to learn how to use SQL with JS?,0,11,0,texto,Resource,Js,https://www.reddit.com/r/webdev/comments/1ghec7j/resource_to_learn_how_to_use_sql_with_js/
webdev,1ghe4ks,what happened to javascripting.com?,0,3,0,texto,,Outros,https://www.reddit.com/r/webdev/comments/1ghe4ks/what_happened_to_javascriptingcom/
webdev,1ghd6uo,My Web Game finally found Product Market Fit! ,192,43,0,link,,Outros,https://i.redd.it/v3m6wkq39cyd1.png
webdev,1ghc98s,Looking for Honest Feedback on a Portfolio Inspiration Site for Developers,3,2,0,texto,,Outros,https://www.reddit.com/r/webdev/comments/1ghc98s/looking_for_honest_feedback_on_a_portfolio/
webdev,1ghc32j,Best webserver for fast prototyping? ,0,2,0,texto,Question,Outros,https://www.reddit.com/r/webdev/comments/1ghc32j/best_webserver_for_fast_prototyping/
webdev,1gha4k0,Planning to learn Mern devlopment ,0,5,0,texto,,Outros,https://www.reddit.com/r/webdev/comments/1gha4k0/planning_to_learn_mern_devlopment/
webdev,1gh9m20,Mobile website compatibility ,6,10,0,texto,,Outros,https://www.reddit.com/r/webdev/comments/1gh9m20/mobile_website_compatibility/
webdev,1gh8r21,Page Transitions in Wordpress,0,4,0,texto,,Outros,https://www.reddit.com/r/webdev/comments/1gh8r21/page_transitions_in_wordpress/
webdev,1gh7knp,Basic Things,2,1,0,link,,Outros,https://matklad.github.io/2024/03/22/basic-things.html
webdev,1gh7e07,Frameworks for creating a nice-looking school-week timetable?,2,3,0,texto,,Outros,https://www.reddit.com/r/webdev/comments/1gh7e07/frameworks_for_creating_a_nicelooking_schoolweek/
webdev,1gh6pzf,Best tools for tracking traffic to site?,5,11,0,texto,Discussion,Outros,https://www.reddit.com/r/webdev/comments/1gh6pzf/best_tools_for_tracking_traffic_to_site/
webdev,1gh69jp,"Monitor color, which one should I use?",0,10,0,texto,Question,Outros,https://www.reddit.com/r/webdev/comments/1gh69jp/monitor_color_which_one_should_i_use/
webdev,1gh5vkz,"9 server rendered websites, 2 web scrapers (6h chron), email server, matrix server, Prometheus and Grafana and CICD for GO with plenty overhead. 4 month 100% uptime ",523,79,0,link,Resource,Go,https://i.redd.it/dj84xsd1mayd1.png
webdev,1gh5ql3,Finding search suggestion URLs,1,0,0,texto,Question,Outros,https://www.reddit.com/r/webdev/comments/1gh5ql3/finding_search_suggestion_urls/
webdev,1gh5adf,What's the Cheapest and Easiest Way to Host a Next.js Website?,18,61,0,texto,Question,Js,https://www.reddit.com/r/webdev/comments/1gh5adf/whats_the_cheapest_and_easiest_way_to_host_a/
webdev,1gh4zwv,Looking for Advice for 1st Time C2C Contract,1,0,0,texto,,Outros,https://www.reddit.com/r/webdev/comments/1gh4zwv/looking_for_advice_for_1st_time_c2c_contract/
webdev,1gh4b7h,Clear chache history problem,1,3,0,texto,Question,Outros,https://www.reddit.com/r/webdev/comments/1gh4b7h/clear_chache_history_problem/
webdev,1gh3oc5,Monthly Getting Started / Web Dev Career Thread,6,28,0,texto,Monthly Career Thread,Outros,https://www.reddit.com/r/webdev/comments/1gh3oc5/monthly_getting_started_web_dev_career_thread/
webdev,1gh3mc3,Centering a div ,0,24,0,link,,Outros,https://www.reddit.com/gallery/1gh3mc3
webdev,1gh3gs6,"Alternatives to ""carrd.co"" Must force SSL certificate , custom domain is not necessary",0,8,0,texto,,Outros,https://www.reddit.com/r/webdev/comments/1gh3gs6/alternatives_to_carrdco_must_force_ssl/
webdev,1gh38fz,What's your favorite very minimal personal website with focus on blogging and portfolio/resume,5,7,0,texto,,Outros,https://www.reddit.com/r/webdev/comments/1gh38fz/whats_your_favorite_very_minimal_personal_website/
webdev,1gh2qof,How to deploy react app?,0,9,0,texto,Question,React,https://www.reddit.com/r/webdev/comments/1gh2qof/how_to_deploy_react_app/
webdev,1gh2n7f,"What is a ""static website"" by hosting meaning?",112,46,0,texto,Question,Outros,https://www.reddit.com/r/webdev/comments/1gh2n7f/what_is_a_static_website_by_hosting_meaning/
webdev,1gh1pmp,THEMES!,0,3,0,texto,Resource,Outros,https://www.reddit.com/r/webdev/comments/1gh1pmp/themes/
webdev,1gh1p8f,Why is datetime-local input locked to browser locale and not configurable?,6,7,0,texto,Question,Outros,https://www.reddit.com/r/webdev/comments/1gh1p8f/why_is_datetimelocal_input_locked_to_browser/
webdev,1gh1gaj,What should I be adding to my skillset?,12,10,0,texto,,Outros,https://www.reddit.com/r/webdev/comments/1gh1gaj/what_should_i_be_adding_to_my_skillset/
webdev,1gh0a2u,Domain registrar that lets you own a domain,0,22,0,texto,,Outros,https://www.reddit.com/r/webdev/comments/1gh0a2u/domain_registrar_that_lets_you_own_a_domain/
