subreddit,post_id,titulo,upvotes,comentarios,compartilhamentos,formato,tags,linguagem,url
programming,1gjgdrb,Cool Math Game [ Console Python ] Beginner made,0,3,0,link,,Python,https://github.com/UndefiendUserNull/Cool-Math-Game
programming,1gjgcio,A Series of Consecutive Webinars on AI Agents by Industry Leaders,0,0,0,link,,Outros,https://open.substack.com/pub/diamantai/p/agentcraft-hackathon-kickoff-educational?utm_source=share&utm_medium=android&r=336pe4
programming,1gje119,"Comprehensive Go Web Frameworks Comparison: Gin, Echo, and BeeGo - Vitalii Honchar",0,0,0,link,,Go,https://vitaliihonchar.com/blog/go/web-frameworks-comparison
programming,1gjdf7y,tinylangs: programming languages in 50 lines of code,215,28,0,link,,Outros,https://github.com/zserge/tinylangs/
programming,1gjbvo5,CLI tool to analyze and report TODO comments in JavaScript and TypeScript Git repositories,2,3,0,link,,JavaScript,https://github.com/azat-io/todoctor
programming,1gjbf24,"Why Avoiding Technical Debt Might Be Your Biggest Mistake: Embrace Progress, Not Perfection",0,10,0,link,,Outros,https://shahriyarshahrabi.medium.com/why-avoiding-technical-debt-might-be-your-biggest-mistake-embrace-progress-not-perfection-b13a3fe2c91f
programming,1gjauzb,Master 20 Essential TypeScript Tricks: Write More Efficient Code in 2024,0,7,0,link,,TypeScript,https://jsdev.space/20-ts-tricks/
programming,1gjaka9,Segmenting Credit Card Customers with K-Means: A Fun Dive into Clustering,5,0,0,link,,Outros,https://medium.com/@med.elhamly/segmenting-credit-card-customers-with-k-means-a-fun-dive-into-clustering-c7d2ed519b55
programming,1gja1pb,"How to create a bubble animation with Tailwind CSS and JavaScript
",0,0,0,link,,JavaScript,https://lexingtonthemes.com/tutorials/how-to-create-a-bubble-animation-with-tailwind-css-and-javascript/
programming,1gj7tge,New Parser Generator on the Block,0,19,0,link,,Outros,https://algodal.itch.io/algodal-parser-generator-tool
programming,1gj7kcs,"Auth Wiki -  Clear definitions of key glossaries related to authentication, authorization, and identity management. ",32,9,0,link,,Outros,https://auth.wiki/
programming,1gj2p6f,In Memory of Stiver,81,3,0,link,,Outros,https://blog.jetbrains.com/idea/2024/11/in-memory-of-stiver/
programming,1giwl1h,I made a 3D Text Editor in React from Scratch,0,2,0,link,,React,https://www.youtube.com/watch?v=HWbdZlhi0WM
programming,1giw7kh,Laravel Under The Hood - A Little Bit of Macros,0,0,0,link,,Outros,https://blog.oussama-mater.tech/laravel-a-little-bit-of-macros/
programming,1giuiem,Why Your API is â€˜Broken by Designâ€™ Without JSON Schema,0,13,0,link,,Outros,https://medium.com/@apalshah/why-your-api-is-broken-by-design-without-json-schema-9f406216c903?sk=d37c8e3e4e57724a5e63b7d85a7e57a5
programming,1giu0fa,"C++, Complexity, and Compiler Bugs",36,27,0,link,,C,https://azeemba.com/posts/cpp-complexity-compiler-bugs.html
programming,1giu01w,LLM Frameworks are Like ORMs in the 80s,181,112,0,link,,Outros,https://tselai.com/llm-frameworks
programming,1git9xs,CellSplit: Programmable bots in Agar.io-like environment,3,1,0,link,,Outros,https://www.cellsplit.org/bots
programming,1git8nl,"120 Dog Breeds, more than 10,000 Images: Deep Learning Tutorial for dogs classification ðŸ•â€ðŸ¦º",0,1,0,link,,Outros,https://medium.com/p/b0008357e39c
programming,1git27q,Bootstrapping CRUD with Pongo,0,0,0,link,,Outros,https://event-driven.io/en/crud_with_pongo/
programming,1gistfe,Generate ER-Diagram using SQL script - SQL2ER,7,2,0,link,,Outros,https://github.com/tusharad/sql2er
programming,1gis2k3,Python arguments playlist,0,0,0,link,,Python,https://www.youtube.com/playlist?list=PL6lxxT7IdTxEUYw0etp-KL8JSYk3M_9Pg
programming,1girqal,PR Review Tool - making code reviews way easier (free & open source),0,4,0,link,,Outros,https://www.npmjs.com/package/pr-reviewer
programming,1giqvp0,5 Lessons I learned the hard way from 10+ years as a software engineer,460,126,0,link,,Outros,https://read.highgrowthengineer.com/p/5-lessons-i-learned-the-hard-way-from-10-years
programming,1giozwi,5 (Wrong) Regex To Parse Parentheses,20,20,0,link,,Outros,https://aartaka.me/paren-regex
programming,1giox8w,Discipline over Motivation in the engineering industry,0,2,0,link,,Outros,https://newsletter.eng-leadership.com/p/discipline-over-motivation-in-the
programming,1ginfnb,Latest release of C++ DataFrame,7,0,0,link,,C,https://github.com/hosseinmoein/DataFrame
programming,1gineoj,Responsive Registration Form in HTML and CSS,0,0,0,link,,HTML,https://jvcodes.com/responsive-registration-form-in-html-and-css/
programming,1gimzn8,"Software Development is a Cultural Ecology. Work with it, not against it. Stop writing coding conventions and policy documents. Instead, start changing the development ""environment"" to make the-right-thing(TM) the path of least resistance.",226,69,0,link,,Outros,https://anderssundman.medium.com/welcome-to-the-jungle-b0864a76d7f0
programming,1gilzhk,I Waited 10 Billion Cycles and All I Got Was This Loading Screen,198,48,0,link,,Outros,https://blog.preyneyv.dev/doing-less-with-more
programming,1giljkz,Debian in WSL not Ubuntu,0,2,0,link,,Outros,https://talepunk.com/tech/debian-in-wsl-not-ubuntu/
programming,1gil5zb,Exploring Directories in Node.js: Retrieve All Files and Folders,0,0,0,link,,Js,https://jsdev.space/files-dirs-nodejs/
programming,1gil42w,How to use Reducer in React for better State Management: 2 effective ways for simpler design and architecture,6,0,0,link,,React,https://thetshaped.dev/p/how-to-use-reducer-in-react-for-better-and-simpler-state-management
programming,1gikfx7,Fitting Flappy Bird (Assets Included) onto a QR Code ,15,7,0,link,,Outros,https://www.youtube.com/watch?v=CDMbnNxvrVM
programming,1gijbgw,Is copilot a huge security vulnerability?,671,258,0,link,,Outros,https://docs.github.com/en/copilot/managing-copilot/managing-github-copilot-in-your-organization/setting-policies-for-copilot-in-your-organization/excluding-content-from-github-copilot
programming,1gihakr,"The original author of the Fernflower Java decompiler, Stiver, has died",375,8,0,link,,Java,https://blog.jetbrains.com/idea/2024/11/in-memory-of-stiver/
programming,1giawg4,Made a cool startup script that helps you quit smoking,9,8,0,link,,Outros,https://github.com/0x0elliot/viceChecker
programming,1gi824f,Build a Secure Transaction System with Django Rest Framework (DRF) - Step-by-Step Guide,0,0,0,link,,Outros,https://youtu.be/81k2pj436wA
programming,1gi54e4,the death of the architect,0,13,0,link,,Outros,https://explaining.software/archive/the-death-of-the-architect/
programming,1gi4fbf,"Breaking CityHash64, MurmurHash2/3, wyhash, and more...",47,5,0,link,,Outros,https://orlp.net/blog/breaking-hash-functions/
programming,1gi3i24,Bold 0.4 - PrettyPrinting in the debugger,11,8,0,link,,Outros,https://bold-edit.com/changelog/0.4.html
programming,1gi2oyz,More than 30% of PRs in public GitHub repos are from bots,575,79,0,link,,Outros,https://twitter.com/valyala/status/1852675989588873244
programming,1gi124a,"C Until It Is No Longer C
",123,63,0,link,,C,https://aartaka.me/c-not-c
programming,1gi0zc7,Introducing the New BIP38 Desktop Application: Secure Your Private Keys Across 150+ Cryptocurrencies,0,0,0,link,,Outros,http://github.com/meherett/python-bip38
programming,1ghv63m,Why doesn't Cloudflare use containers in their infrastructure?,347,139,0,link,,Outros,https://shivangsnewsletter.com/p/why-doesnt-cloudflare-use-containers
programming,1ghu1iy,Building an Internal Chatbot That Knows All Your Docs: a Step-by-step guide,0,0,0,link,,Outros,https://medium.com/taranis-ag/building-an-internal-chatbot-that-knows-all-your-docs-a-step-by-step-guide-d910dfb26041
programming,1ght84o,Git Setup CLI Program,0,0,0,link,,Outros,https://github.com/ApexV2/git-setup
programming,1ghsxl0,Animated explanation on how DRAM works in GPUs and why should you care,16,1,0,link,,Outros,https://www.youtube.com/watch?v=huhg3V4ZRW0
programming,1ghs7is,Simple Tips for Bug Bounty Beginners: Escalating Open-Redirect to XSS,0,0,0,link,,Outros,https://medium.com/@anishnarayan/simple-tips-for-bug-bounty-beginners-escalating-to-xss-xss-series-part-2-1d6b75ecf942
programming,1ghrvch,Superstreamer - OSS streaming toolkit from video source to player,8,9,0,link,,Outros,https://github.com/matvp91/superstreamer
programming,1ghrr5h,Weird Lexical Syntax,77,19,0,link,,Outros,https://justine.lol/lex/
programming,1ghpb0h,Exponential rate limiting,44,1,0,link,,Outros,https://dotat.at/@/2024-09-02-ewma.html
programming,1ghmr77,Simple sdl3 raycaster,3,8,0,link,,Outros,https://github.com/nfriel/raycast_sdl3
programming,1ghmprh,Open-sourced QueryFlip: Auto-switching between Google & ChatGPT based on query length,0,0,0,link,,Outros,https://github.com/cbora/query-flip
programming,1ghlapi,Classic 3D videogame shadow techniques,15,2,0,link,,Outros,https://30fps.net/pages/videogame-shadows/
programming,1ghigws,Reverse Engineering Minified Code Using OpenAI,0,2,0,link,,Outros,https://glama.ai/blog/2024-08-29-reverse-engineering-minified-code-using-openai
programming,1ghgewg,How to Build Smaller Container Images: Docker Multi-Stage Builds,18,6,0,link,,Outros,https://labs.iximiuz.com/tutorials/docker-multi-stage-builds
programming,1ghfmub,pg_mooncake: columnstore table in Postgres writing iceberg/delta.,7,2,0,link,,Outros,https://github.com/Mooncake-Labs/pg_mooncake/
programming,1ghffjy,Revisiting Reliability in Large-Scale Machine Learning Research Clusters,0,0,0,link,,Outros,https://glennklockwood.com/garden/papers/revisiting-reliability-in-large-scale-machine-learning-research-clusters
programming,1gheza4,Made a video that should work as an intro to ROM hacking for translation for those interested!,14,6,0,link,,Outros,https://www.youtube.com/watch?v=CHE03KiiQ7k
programming,1gheinm,Debugging spiky memory in our backend,1,0,0,link,,Outros,https://www.linkedin.com/pulse/debugging-spiky-memory-our-backend-mohamed-habib-s8cye/?trackingId=7V%2FSeWVUSOKREniiJR8wKQ%3D%3D
programming,1ghcsu1,DuckDB over Pandas/Polars ,0,1,0,link,,Outros,https://pgrs.net/2024/11/01/duckdb-over-pandas-polars/
programming,1ghbwr1,From Naptime to Big Sleep: Google's security AI Agent has found its first real-world vulnerability in an open-source codebase,212,22,0,link,,Outros,https://googleprojectzero.blogspot.com/2024/10/from-naptime-to-big-sleep.html
programming,1ghafvy,Chris Krycho: What if version control was AWESOME? - Introduction to Jujutsu.,0,27,0,link,,Outros,https://m.youtube.com/watch?v=2otjrTzRfVk&pp=ygUXanVqdXRzdSB2ZXJzaW9uIGNvbnRyb2w%3D
programming,1ghaau7,Microservices and APIs: How They Work Together,0,0,0,link,,Outros,https://apidna.ai/?p=4539
programming,1gh9pl6,It's a joke about the basic life of a programmer in code language; lua,0,0,0,link,,Lua,https://pastebin.com/fWQDVF6M
programming,1gh9ltr,"Moving off Heroku, slowly",40,5,0,link,,Outros,https://jamie.ideasasylum.com/2024/10/30/moving-off-heroku-slowly
programming,1gh99kc,Side Quests That Supercharged A Tech Executiveâ€™s Career,13,13,0,link,,Outros,https://pathtostaff.substack.com/p/side-quests-that-supercharged-a-tech
programming,1gh7vgg,Notepad++ is 21 years old,2318,244,0,link,,Outros,https://sht.ac/2kzVlI
programming,1gh7la9,Andrew Favia | Python has a hidden small text editor available. With Emacs Keybindings.,0,2,0,link,,Python,https://andrewfavia.dev/posts/text-editor-in-python/
programming,1gh75fg,Raspberry Pi Performance Update: NUMA Memory Configuration Gains,1,0,0,link,,Outros,https://news.squeak.org/2024/11/01/raspberry-pi-performance-update-numa-memory-configuration-gains/
programming,1gh5ti4,LLQL: Running SQL Query on LLVM IR/BC with Pattern Matchers,4,0,0,link,,Outros,https://github.com/AmrDeveloper/LLQL
programming,1gh4i8t,"A bit about OSS Licenses, explained with LEGO analogy",46,11,0,link,,Outros,https://kftray.app/blog/posts/9-oss-legos
programming,1gh2uqq,disposables: Run your test dependencies in disposable containers.,12,2,0,link,,Outros,https://github.com/akashrawal/disposables
programming,1gh2svu,Why those particular integer multiplies?,4,0,0,link,,Outros,https://fgiesen.wordpress.com/2024/10/26/why-those-particular-integer-multiplies/
programming,1gh2o4m,Always-free Vue & Node admin panel framework,67,1,0,link,,Vue,https://adminforth.dev/
programming,1gh1zc9,GitHub - brunodev85/winlator: Android application for running Windows applications with Wine and Box86/Box64,15,2,0,link,,Outros,https://github.com/brunodev85/winlator
programming,1gh1vlq,Linus Torvalds Lands A 2.6% Performance Improvement With Minor Linux Kernel Patch,1918,286,0,link,,Outros,https://www.phoronix.com/news/Linus-2.6p-Faster-Scale-Patch
programming,1gh1cpv,Many Armed Banditism,11,0,0,link,,Outros,https://voidflower.dev/blog/many-armed-banditism
programming,1ggzb8a,Using GPT-4o for web scraping,0,1,0,link,,Outros,https://blancas.io/blog/ai-web-scraper/
programming,1ggwhoa,Embeddings are underrated,88,35,0,link,,Outros,https://technicalwriting.dev/data/embeddings.html
programming,1ggweqo,Amazon Aurora PostgreSQL Limitless Database is now generally available,11,0,0,link,,Outros,https://aws.amazon.com/blogs/aws/amazon-aurora-postgresql-limitless-database-is-now-generally-available/
programming,1gguns9,A horror story for Halloween,13,5,1,link,,Outros,https://meowbark.dev/A-Halloween-scary-story
programming,1ggqcua,"My key takeaways from Microsoft research paper about pull requests effectiveness factors. Together with Delft University, they reduced PR lifetime from 197.2 hours to 77.65 hours",386,73,0,link,,Outros,https://reviewnudgebot.com/blog/how-to-accelerate-code-reviews-with-nudges-insights-from-microsofts-study/
programming,1ggq2cx,The more time I spend developing the more frustrated I get that so many open source projects aren't truly open source. Once the maintainers can no longer maintain their projects they get abandoned and there is no way to update them.,0,11,0,link,,Outros,https://medium.com/@loic.joachim/github-needs-to-handle-open-source-like-wikipedia-74f6219a2eee
programming,1ggobtp,"Week 2 of ""52 Weeks of SRE"": Application Monitoring Fundamentals. Learn the theory and put it into practice with this in-depth article.",154,7,0,link,,Outros,https://jpereira.me/week-2-monitoring-fundamentals/
programming,1gglquh,"ðŸ’¥ Tech Talks Weekly #35: Design Patterns for Resilient Data Pipelines, Constructive Code Reviews, Exciting new features in C# 9 - 12, Async Functions In Python 2.1, Vertical Slice Architecture, and many more!",0,0,0,link,,Python,https://www.techtalksweekly.io/p/ttw-35-design-patterns-for-resilient
programming,1ggllsj,Cramming Solitaire onto a Nintendo E-Reader card,2,1,0,link,,Outros,https://mattgreer.dev/blog/cramming-solitaire-onto-a-nintendo-ereader-card/
programming,1ggjb5c,There is no such thing as a global method (in Ruby),0,0,0,link,,Ruby,https://zverok.space/blog/2024-10-21-global_functions.html
programming,1ggj3xg,Australia/Lord_Howe is the weirdest timezone,69,14,0,link,,Outros,https://ssoready.com/blog/engineering/truths-programmers-timezones/
programming,1ggicd8,Pure CSS Directional Hover Effect for Grouped Elements,0,0,0,link,,Outros,https://jsdev.space/directional-hover-effect/
programming,1ggi3gr,"The most successful open-source fork, worth $6B",0,0,0,link,,Outros,https://quesma.com/blog-detail/elastic-vs-grafana
programming,1gghpow,com-lihaoyi issue bounties Oct 2024,0,0,0,link,,Outros,https://github.com/orgs/com-lihaoyi/discussions/6
programming,1gghls8,A brief interview with Moonbit creator Hongbo Zhang,12,0,0,link,,Outros,https://pldb.io/blog/hongboZhang.html
programming,1gghdhx,Tip of the day #3: Convert a CSV to a markdown or HTML table,0,0,0,link,,HTML,https://gaultier.github.io/blog/tip_of_day_3.html
programming,1gggz3z,Fetching Time records from ActiveCollab API,0,0,0,link,,Outros,https://www.createit.com/blog/fetching-time-records-from-activecollab-api/
programming,1gggnwj,Safety and Liveness,0,0,0,link,,Outros,https://www.thecoder.cafe/p/safety-liveness
programming,1ggg67q,Typesetting Engines: A Programmer's Perspective (LaTeX vs. Typst vs. HTML),27,17,0,link,,HTML,https://blog.ppresume.com/posts/on-typesetting-engines
programming,1ggf6xx,"Frontent Architecture, Backend Architecture or just Architecture?",0,0,0,link,,Outros,https://www.architecture-weekly.com/p/frontent-architecture-backend-architecture
programming,1ggf4c1,"Disposable Web Servers: Solve it, then Toss it",21,2,0,link,,Outros,https://www.bugsink.com/blog/disposable-web-servers/
programming,1ggf3hg,Demo: Exploiting leaked timestamps from Google Chrome extensions,6,0,0,link,,Outros,https://fingerprint.com/blog/exploiting-leaked-timestamps-google-chrome-extensions/
programming,1ggdtub,Is Agile Dead? Why Large Enterprises Are Moving Away from Agile and How It Impacts Developers ,0,29,0,link,,Outros,https://sht.ac/RqmPSR
programming,1ggd62b,Github introduces sparks,0,9,0,link,,Outros,https://bytesofai.com/2024/10/31/github-unveils-spark-a-new-era-of-customizable-mini-applications/
programming,1ggb04w,State Of CSS 2024 Results | CSS-Tricks,14,6,0,link,,Outros,https://css-tricks.com/state-of-css-2024-results/
programming,1gganlz,Why Pascal Deserves a Second Look,189,173,0,link,,Outros,https://timcoatesinsights.wordpress.com/2024/10/31/why-pascal-deserves-a-second-look/
programming,1ggaljn,Who stands to benefit from a proposed split of JavaScript?,175,190,0,link,,JavaScript,https://leaddev.com/technical-direction/should-javascript-really-be-split-in-two
programming,1ggake4,A Primes Potpourri coded in Python,0,0,0,link,,Python,https://coe.psu.ac.th/ad/primes/
programming,1ggabxo,Create a URL Shortener Service with Pure Rails,2,1,0,link,,Outros,https://youtu.be/-9cdUvVFVFY?si=vHiFMjkC77l2Gs_V
programming,1gga472,Why I don't rely on AI for programming (too much),0,10,0,link,,Outros,https://www.jonashietala.se/blog/2024/10/31/why_i_dont_rely_on_ai_for_programming_too_much/
programming,1gg9jsm,The Dual Nature of Events in Event-Driven Architecture,2,1,0,link,,Outros,https://www.reactivesystems.eu/2024/10/31/the-dual-nature-of-events-in-eda.html
programming,1gg9fds,Pylon: Enables TypeScript developers to easily build GraphQL APIs,2,5,0,link,,TypeScript,https://github.com/getcronit/pylon
programming,1gg8avg,Avoiding Circular Imports in Python,0,0,0,link,,Python,https://youtu.be/zRwg7w93klA?si=1OXRgY2P_yMJWO_-
programming,1gg8852,blazed.js,0,17,0,link,,Js,https://www.npmjs.com/package/blazed.js
programming,1gg5q98,"K4 - New high-performance open-source LSM tree based, transactional, durable storage engine ",5,1,0,link,,Outros,https://github.com/guycipher/k4
programming,1gg53cc,math4devs.com: List of mathematical symbols with their JavaScript equivalent.,4,4,0,link,,JavaScript,https://math4devs.com/
programming,1gg4yc1,Just learned why Rust doesn't allow multiple mutable references. Not what I thought.,0,17,0,link,,Rust,https://manishearth.github.io/blog/2015/05/17/the-problem-with-shared-mutability/
programming,1gg081j,Scrum doesn't have to suck,0,2,0,link,,Outros,https://blog.raed.dev/posts/scrum_doesnt_have_to_suck
programming,1gfzupi,The PACELC Theorem,5,0,0,link,,Outros,https://www.thecoder.cafe/p/pacelc
programming,1gfzk8e,Sorting for Rendering,2,2,0,link,,Outros,https://linebender.org/wiki/gpu/sorting/
programming,1gfv393,Polipo: The First Figma Compiler,13,18,0,link,,Outros,https://www.polipo.io/blog/polipo-the-first-figma-compiler
programming,1gfuiwt,(P)OOP Programming | Why OOP Is Bad,0,9,0,link,,Outros,https://medium.com/@2code/p-oop-programming-8f32f2f0d54f
programming,1gfu25z,"GitHub - hypermodeinc/modus: Modus: an open source, serverless framework for building intelligent functions and APIs, powered by WebAssembly",0,0,0,link,,Outros,https://github.com/hypermodeinc/modus
programming,1gftcpu," A huge list of all PyCon deep dives (a.k.a. ""Tutorials"") grouped by year and ordered by view count",0,0,0,link,,Outros,https://www.techtalksweekly.io/p/ttw-extra-8-pycon-deep-dives-aka
programming,1gfs742,Getting Started with LangchainJS: Build a Flexible AI Prompt Service,0,0,0,link,,Outros,https://passarella.dev/p/getting-started-with-langchainjs-build-a-flexible-ai-prompt-service
programming,1gfs2fx,ASP.NET Core Authentication Behind Proxies,0,0,0,link,,Outros,https://a0.to/reddit/aspnet-core-authentication
programming,1gfrv3k,Australia/Lord_Howe is the weirdest timezone,189,18,0,link,,Outros,https://ssoready.com/blog/engineering/truths-programmers-timezones/
programming,1gfrrxx,Software Development Fragmentation,2,1,0,link,,Outros,https://yieldcode.blog/post/software-development-fragmentation/
programming,1gfr6no,Template for making VSCode extensions using TRPC for webview panel message passing,0,0,0,link,,Outros,https://philipwee.com/blog/TRPC%20implementation%20for%20VSCode%20extension%20message%20passing
programming,1gfqxqo,Google CEO says over 25% of new Google code is generated by AI,0,15,0,link,,Outros,https://arstechnica.com/ai/2024/10/google-ceo-says-over-25-of-new-google-code-is-generated-by-ai/
programming,1gfqt90,Understanding The HTTP Deprecation Header,18,3,0,link,,Outros,https://zuplo.com/blog/2024/10/25/http-deprecation-header
programming,1gfqoj3,Advent of SQL: 24 Days of SQL Challenges,6,0,0,link,,Outros,http://Adventofsql.com
programming,1gfqm7s,"Longevity, or abandonware?",1,0,0,link,,Outros,https://keygen.sh/blog/longevity-or-abandonware/
programming,1gfqk7w,"I built a free AI PR reviewer that actually understands your entire codebase (1-click install, no config needed, currently Total Free) ðŸš€",0,2,0,link,,Outros,https://github.com/marketplace/llamapreview/
programming,1gfqb3n,High Performance Open Source EBPF Based Linux IPv4/v6 Firewall Project,2,0,0,link,,Outros,https://github.com/netfoundry/zfw
programming,1gfq6wd,You Keep Using That Word â€¢ Sam Newman,0,0,0,link,,Outros,https://youtu.be/IawEKBxjs14
programming,1gfq59e,The history of the Monokai color scheme,3,7,0,link,,Outros,https://monokai.pro/history
programming,1gfpr1x,Essential Best Practices for Securing your Applications (Inspired by the recent ShipFast controversy). Your feedback is much appreciated!,2,0,0,link,,Outros,https://jpereira.me/security-first-essential-best-practices-for-securing-your-application/
programming,1gfpip5,Supabase and ClickHouse Partnership,0,0,0,link,,Outros,https://clickhouse.com/blog/supabase-partnership-native-postgres-replication-clickhouse-fdw
programming,1gfpgq4,Why sprints are taking the joy out of building software,955,428,0,link,,Outros,https://zaidesanton.substack.com/p/why-sprints-are-broken
programming,1gfpcee,New to the web platform in October,0,1,0,link,,Outros,https://web.dev/blog/web-platform-10-2024?hl=en
programming,1gfodhx,"I made an open-source, local time tracker",0,0,0,link,,Outros,https://github.com/CodeClimbersIO
programming,1gfo8d6,There is No Such Thing as a Unit Test,0,56,0,link,,Outros,https://www.awwsmm.com/blog/there-is-no-such-thing-as-a-unit-test
programming,1gfmvtc,Comparing performance of concurrent HTTP requests in different languages,0,11,0,link,,Outros,https://github.com/jordinl/concurrent-http-requests-comparison
programming,1gfljj7,Lessons learned from a successful Rust rewrite,118,28,0,link,,Rust,https://gaultier.github.io/blog/lessons_learned_from_a_successful_rust_rewrite.html
programming,1gfl0cn,All books recommended on Ask HN,3,0,0,link,,Outros,https://hackernewsbookrecommendations.com/
programming,1gfkulb,Bitwise operation in C++,0,1,0,link,,C,https://www.learninglowlevel.com/posts/cm2uzx6nu0000wodqs0y6lnc5
programming,1gfkpbm,Why is Golang's Compilation Speed So Fast?,0,35,0,link,,Outros,https://www.pixelstech.net/article/1728356198-Why-is-Golang-s-Compilation-Speed-So-Fast
programming,1gfjwg6,In case you missed: Express 5 was released,0,6,0,link,,Outros,https://github.com/expressjs/express/releases/tag/v5.0.0
programming,1gfiusf,User Authentication with Google & GitHub in Next.js Using Prisma and NextAuth,0,0,0,link,,Js,https://jsdev.space/next-oauth-prisma/
programming,1gfiif5,Tip of the day #2: A safer arena allocator,20,7,0,link,,Outros,https://gaultier.github.io/blog/tip_of_the_day_2.html
programming,1gfi49i,TypeScript Style Guide,0,0,0,link,,TypeScript,https://mkosir.github.io/typescript-style-guide/
programming,1gfbwpe,"You Want Modules, Not Microservices",512,227,0,link,,Outros,https://blogs.newardassociates.com/blog/2023/you-want-modules-not-microservices.html
programming,1gfaoml,Unix 1-liner using jq,0,0,0,link,,Outros,https://codefaster.substack.com/p/unix-1-liner-using-jq
programming,1gf79t4,Building Open-Source Tool for PII Masking,0,0,0,link,,Outros,https://github.com/HydroXai/pii-masker-v1
programming,1gf76vw,ðŸš€ Speeding Up MP3 Compilation by 380%,0,3,0,link,,Outros,https://poxate.com/blog/speeding-up-by-300
programming,1gf74ja,"Devs deserve good one-on-ones â€” 3 takeaways from 1,500 meetings",290,77,0,link,,Outros,https://l.perspectiveship.com/re-o3
programming,1gf48hj,How to Implement Server-Sent Events in Go,0,0,0,link,,Go,https://www.youtube.com/watch?v=nvijc5J-JAQ
programming,1gf428u,Flox | It's Time to Bring Nix to Work,23,31,0,link,,Outros,https://flox.dev/blog/its-time-to-bring-nix-to-work/
programming,1gf3vya,"Introduction to Reflection - C# .NET Tutorial
",0,1,0,link,,C,https://youtu.be/b1_Qxw71xNg?si=RurJMq3xkHovokAd
programming,1gf3voq,A Better Merge Workflow with Jujutsu | ofcrse by Benjamin Tan,3,0,0,link,,Outros,https://ofcr.se/jujutsu-merge-workflow
programming,1gf2x7r,Leverage KV stores: persisting Trees and Graphs,3,1,0,link,,Outros,https://danlevy.net/one-weird-trick-to-speed-up-feature-teams/
programming,1gf1yel,Introducing Wasmer 5.0: with iOS support and experimental V8 backend,0,0,0,link,,Outros,https://wasmer.io/posts/introducing-wasmer-v5
programming,1gf0vf9,VSCode October 2024 (version 1.95) (90% of the features are Copilot-related),524,226,0,link,,Outros,https://code.visualstudio.com/updates/v1_95
